author,channel,cid,heart,photo,text,time,votes
Bony Hardian,UCMwWD_Opk5CkpxzOoHGYiwQ,UgxOfz5sjePCmSOS0GB4AaABAg,0.0,https://yt3.ggpht.com/ytc/AKedOLTr7idSvYdim5oDob56a9SE2iVDUiClKpUeEYoUvw=s176-c-k-c0x00ffffff-no-rj,"Cakep betul ini mobil..
Yang pengen banget punya mobil ini, saya doakan terwujud keinginannya.
Aamiin",23 hours ago,0
bow Creative,UCW9XnyE7xfrw4o2kH-afKkw,UgwXAfoER-WQSOMjYa94AaABAg,0.0,https://yt3.ggpht.com/ytc/AKedOLSPghntoeKBKbZ7K7TEb8xshOz8qHIyoJXTZv0ORw=s176-c-k-c0x00ffffff-no-rj,Belanja mobil teroos 😂😂,1 day ago,0
Sugeng Dwiyanto,UCIQDTWVryxkzCLkIh4ezkvw,Ugxdhw18KHrV1XqwLZZ4AaABAg,0.0,https://yt3.ggpht.com/ytc/AKedOLQqKTSbmnWURf31uUnxnlN-mhMzd16ZK6nseg=s176-c-k-c0x00ffffff-no-rj,"Selalu suka lihat ulasan om Fitra... pertama kali lihat raize langsung kagum,...tp gak berdaya buat ganti mobil 😭😭😭 nikmati aja yg aku punya AVANZA 👍👍👍👍",4 days ago,0
kate,UCWIH9qZ8_k7k4guWh93bWQA,Ugy2uwOmciYToy7aTjt4AaABAg,0.0,https://yt3.ggpht.com/ytc/AKedOLSZP11Uc33-xleRVw1tLq_Af3Rbehg9MpPRzWlBzw=s176-c-k-c0x00ffffff-no-rj,"bs beli , amin",5 days ago,0
Mr Sunshine,UCk2l-z5yVNnXMpRKL358RgA,Ugx0I6Ra1g8thcFC1uZ4AaABAg,0.0,https://yt3.ggpht.com/DQQYoaQg4h-LJ0v1Me6vCFAesP1Zqb0heKe1Otp3-KuwFgQUfcypU_x3r1lPvPcuzHYOR9dgag=s176-c-k-c0x00ffffff-no-rj,Gak nyesel beli raize bunggg enak bettttt,6 days ago,0
Ho'oponopono,UCR6dmH4j7FfVgYVXnDSKPgw,UgzASb9G0eVsu_1e1MR4AaABAg,0.0,https://yt3.ggpht.com/ytc/AKedOLSID17efN5hdv8GPp2wQ7P5TU-jHFePFrDZhaQFfA=s176-c-k-c0x00ffffff-no-rj,6:11 pas ngomong kekar langsung ada efek daun jatuh secara natural.... alam mengatakan setuju akan hal itu,7 days ago,0
Halimah Imah,UCab0HfArleqXL5KW1nxWjOg,Ugx0Q-WKYMsJ2J0vt814AaABAg,0.0,https://yt3.ggpht.com/ytc/AKedOLQo6fLC8HA6fWwg4nnzcHr9-HroZWb8B11hTA=s176-c-k-c0x00ffffff-no-rj,buat aplikasi itu yg gampang di ketik jgn buat diri sendiri  jiaz jgb di buat ribet klo mau bnyak yg pkai aplikasinya,7 days ago,0
RAHBINI TV,UCU7L2hI7QDzDMX23TCUC5vw,UgyS7KQye_teR3HOPnx4AaABAg,0.0,https://yt3.ggpht.com/ytc/AKedOLQr08LWzYquBP_NVDWhGP8N5grnRzBOuhQIsn1kFik=s176-c-k-c0x00ffffff-no-rj,"menit ke 28, kok dibandingin sama mercy dan bmw, om.... ah, saya menilai ini kurang obyektif..... weleh weleh....",11 days ago,0
aan,UCjVOgRpGDJzD_bTCFrgy9gA,UgzKiKRdKPwh7prtBiJ4AaABAg,0.0,https://yt3.ggpht.com/ytc/AKedOLSYrBbvAchAagn7JjpIeDIdPaaZAFaamThl99VUEA=s176-c-k-c0x00ffffff-no-rj,"Makasih, mungkin beli second nya sepuluh taun lagi",12 days ago,0
Alex Renji,UCStlMOTuZfzIP2gOXIjjzWw,UgwIQHd9eHn3rSAqfTN4AaABAg,0.0,https://yt3.ggpht.com/ytc/AKedOLQObP-TmzGudgRijHmHTMJa54mAIvEKnX5FwKJe=s176-c-k-c0x00ffffff-no-rj,Kapal Api bikin dong Varian non sugar..,2 weeks ago,0
Yanti Ningsih,UCqhb61DHcLRfk-L7pI8UYPg,Ugz730vFNN4H--EoTnl4AaABAg,0.0,https://yt3.ggpht.com/ytc/AKedOLRXRhw4QUrxp0JRDDkyb78STAswO7_QbV80WW03qOk4LU2aJyHU8wvdiSS0tR-w=s176-c-k-c0x00ffffff-no-rj,masker mas,2 weeks ago,0
Nabhan Anuz,UClFJ7-fnlbgeQKtdPjf107g,UgynQyaT6ce3xb3bIkh4AaABAg,0.0,https://yt3.ggpht.com/pfE3UOZlfedJDTmlxNXJpfcIbhNis7r8YI0bEtSuJNSgMunAnCmlM837uXUj9Y_EWae6EdCt=s176-c-k-c0x00ffffff-no-rj,bagus kok suaranya kyk binatang liar,3 weeks ago,0
GPB CHANNEL,UCc318Ef4BIVVxpIZJYcSE5Q,UgxjFMtDUkVjM-o-kQJ4AaABAg,0.0,https://yt3.ggpht.com/ytc/AKedOLSIIwGEks-_oUssJ-LKW6WFj1CbugZFfNFEC47rSQ=s176-c-k-c0x00ffffff-no-rj,"Cuma 12 menit bisa dapet profit 20juta ?
Kok bisaa???
Gini cara nya 👇
https://youtu.be/XGcrr6gYom0",3 weeks ago,0
stella Ipanemah stella,UC7eybIn6uLTbaPgokhrf10w,UgwUy2V8iPW2EeYpcJZ4AaABAg,0.0,https://yt3.ggpht.com/ytc/AKedOLTJrdLYxA9T4fNpg_MXzDsVoi6S-F8oaGx51w=s176-c-k-c0x00ffffff-no-rj,Saya dri batam bg inden udh gk sabaran mau beli Tipe tertinggi ambil yg merah yg turbo bg kmi beli,4 weeks ago,0
Lukulo Gemstone Garden Pets,UCgoJ2KuKPCaanxZEa6p9EVg,Ugzk6zrVrHzgosDV1DZ4AaABAg,0.0,https://yt3.ggpht.com/HdYsWBCSzczrqi3yScT11lR_Y6P3q8lIcHsdnsatd6d3ojoeR8iWUXwEEB-TEmwDWdge_XAlqA=s176-c-k-c0x00ffffff-no-rj,empuk tapi tidak halus agak kasar..🤣😇😇😇😇,4 weeks ago,0
ferjeq 83,UCYrVa6l2vkwtA6CWT4MWmEw,UgxNu-WR4GhAkARFCnB4AaABAg,0.0,https://yt3.ggpht.com/ytc/AKedOLSYcuok2m4zAMiYD-a3WdJlG5zzOALm3NUNog=s176-c-k-c0x00ffffff-no-rj,MESIN NYA hanya 3 silinder ngapain dibeli👎👎👎👎👎👎👎👎👎👎,1 month ago,0
daum m Totong,UC9QdicNP1NWXMEGRd6ArNJQ,Ugz3cxiVNLL4zYEsAzJ4AaABAg,0.0,https://yt3.ggpht.com/ytc/AKedOLSV8_mQYH31UTCSi3lqwAkPr5fTa3h3EDddZmGfhQ=s176-c-k-c0x00ffffff-no-rj,Ganteng sekali tampilan mobile ini Om ... Like,1 month ago,0
Cipto Hendrawan,UCe12EiLIbKEvFtUMoQwE2TQ,UgziG--DBB1YYuAU5P14AaABAg,0.0,https://yt3.ggpht.com/ytc/AKedOLQuwsBjXCx9wj6F9nag7LvtUUy3O8ZE9DvmaQ=s176-c-k-c0x00ffffff-no-rj,Terimakasih om semakin yakin buat beli.,1 month ago,0
Raiden,UCMZCEt0LZRA4G9lYORb17PQ,UgwOKgOCvFp5kpUgQ7d4AaABAg,0.0,https://yt3.ggpht.com/ytc/AKedOLT9Ihf6DZFk2TTTAb8acL4qhpL-VRJaADgVOdQsbQ=s176-c-k-c0x00ffffff-no-rj,Cup holder bisa buat coca cola ukuran besar gak om? 🤣,1 month ago,0
Atiqah channel,UCPXX33RiqESdbff44LJEWbg,Ugy-KnhMGsCm_BO2FVd4AaABAg,0.0,https://yt3.ggpht.com/ytc/AKedOLSge-KJhctxZ3rQXzLvI3_g0XdBi7fkfWELOFKM=s176-c-k-c0x00ffffff-no-rj,“Kapal Api Signature”.,1 month ago,0
Muhammad Reza Pahlevy,UCTY-c9GfJpECjXkNMPZ8IPA,UgyS7KQye_teR3HOPnx4AaABAg.9UjL5f4cKu89Uk8iF8E60E,0.0,https://yt3.ggpht.com/n7UcIZ4K_Y9VuZV7cWjbTZQw16fXc32l9yvj7eQUvqBWCnoXi7Fcsqmazj34muUDtuBZvUki=s176-c-k-c0x00ffffff-no-rj,"Tapi emg bener sih kalo settings MiD gitu apalagi pas lagi jalan rada gmn gt hahaha, ya oke lah kalo buat alasan safety mah yak ekekekek 🤣.",11 days ago,0
Dewi R_Tunas Toyota Pecenongan,UCy7mSK9DzUe1lorC0WpmcWA,UgziG--DBB1YYuAU5P14AaABAg.9Tp_jp1qt9E9U45-NwVS57,0.0,https://yt3.ggpht.com/xdPUT0HNggvC3VQ4limsANkGyHB5oSPndYd0-Aj17xM-BtEZ0Hwtjoz5Civm7HVeUL3-L6JvZg=s176-c-k-c0x00ffffff-no-rj,Halo kak bisa dibantu untuk info dan pemesanan mobil Toyota nya dengan saya. Makasih 😊🙏,4 weeks ago,0
Zulkhaery Basrul,UCvTjLSG2pPWglZ_2uPPEW0g,UgwYK5srZT07yXDWvCR4AaABAg,0.0,https://yt3.ggpht.com/ytc/AKedOLRnNufNIQD-QJfyHgWNvQh50wZC9gK4oOz5vXko2g=s176-c-k-c0x00ffffff-no-rj,Bayi Fortuner,1 month ago,0
DZNart,UCF3wnDui9YT1uz2NsB3XBkQ,UgwrhZOldC7QLExhEaZ4AaABAg,0.0,https://yt3.ggpht.com/ytc/AKedOLQZUg0JD013xpG_zX4VqewGC7pDH5GIvKuOHph2Ew=s176-c-k-c0x00ffffff-no-rj,Istri yg tertarik dengan mobil ini ❤️. semoga bisa terbeli yah bund.,1 month ago,0
Andree August,UCT6GBkgUh4brb04nYLoNz5Q,UgxkNi1-yyJNu-G5c194AaABAg,0.0,https://yt3.ggpht.com/ytc/AKedOLSn4UroDuEEEqrFnp1TB9QjfKSBuH-FLLq96Syw4A=s176-c-k-c0x00ffffff-no-rj,Modelnya bagus cuman sayang mesin cuman 1000cc,1 month ago,0
Renov Matheus,UCBpNjU48uvwmaGPrTDjcScg,Ugy17DH9Ru1kNG8hlJV4AaABAg,0.0,https://yt3.ggpht.com/ytc/AKedOLQx4Cfo7fEOnrPWOYyrpUevXB2N54HKBC-nKBnIIw=s176-c-k-c0x00ffffff-no-rj,Sama avanza enak mana om ?,1 month ago,0
ReanShare រៀនចែករំលែក,UC-z6YPiNvJluhshz7anjJxw,Ugx8LrZ0LoyT_i1USx54AaABAg,0.0,https://yt3.ggpht.com/ytc/AKedOLTGSWPS8qHkUVshG_y-7qL051yr0xodX5ILpIa7QYo=s176-c-k-c0x00ffffff-no-rj,is it good for long distance trip ?,1 month ago,0
wibisono hartoni,UClyQGEUQuhLKML1QQyfYTgA,Ugz5AP7hwmimXlk40DB4AaABAg,0.0,https://yt3.ggpht.com/ciGRYlqwTTITai0o_-f3KbY9uZNQnCz6Wx_I7IHNf3XNmP_-kec0YJqUBQBMNhZCG5YL2BLV2w=s176-c-k-c0x00ffffff-no-rj,gak ada yg coba test drive di tanjakan misalnya ...???,1 month ago,0
Handoko,UC3xilnFZQctgpZ6dg80dm2Q,UgyOj088mx5OV1jZCl94AaABAg,0.0,https://yt3.ggpht.com/ytc/AKedOLROYLlJOhoXGyTO7zCZqOTVRlwuL8piihWcjcNQsQ=s176-c-k-c0x00ffffff-no-rj,"Om radius putarnya Raize terlalu lebar ya, bener gak?",1 month ago,0
ferdinan sapto,UC80qVkxZtTDqITPthyG9OiQ,UgwqQYmMNLjfex8A0jF4AaABAg,0.0,https://yt3.ggpht.com/ytc/AKedOLQOoF_EhK0zrhaRK2OkxG_oE78_KPXBayTrdpSk8Q=s176-c-k-c0x00ffffff-no-rj,"Coba jalan di Tol layang Japek om, gimana suspensi nya?",1 month ago,0
Suci Diary,UCkBXhivzxEQbebKM_PV0cpQ,UgxxNbEaZgC3deKqWeJ4AaABAg,0.0,https://yt3.ggpht.com/ytc/AKedOLSfaTbwVxytvMPJTPdAxdD1S7u-Y-DUN7Yf2PD5Qw=s176-c-k-c0x00ffffff-no-rj,"Jaminan service Free-nya 4 tahun atau 50.000 KM bang Fitra, ralat sedikit 🙏🏻",1 month ago,0
Mas Angga Daihatsu,UCWcPmp4Pd8Ng01cF2PY3orw,Ugzkva9y9mjlQMIEYK54AaABAg,0.0,https://yt3.ggpht.com/ytc/AKedOLRFEZ4aNK-aG9rmJ-vSwRbD_FWPgAWqSyf02DSETQ=s176-c-k-c0x00ffffff-no-rj,"Keren bingits Raize, Versi Rocky juga Keren & Nyaman Om 😁... 
Info, Test Drive & Pemesanan  ( Jateng dan DIY ) bisa ke Channel Saya
- ANGGA DAIHATSU - 
di : https://www.youtube.com/watch?v=LWZt69dkFXc",1 month ago,0
theindonesia85,UCEPmSnC1lhZzBuD8GxIocgg,Ugyb0mtmGURdA-uW6FJ4AaABAg,0.0,https://yt3.ggpht.com/ytc/AKedOLRbB3oKrQ27Bf4RUZzd1v7FVgyCbsC9MAS9_Q=s176-c-k-c0x00ffffff-no-rj,Ground clearance 20cm ini masih berlaku dg kit GR?,1 month ago,0
remy lan,UClt9z3xmuyyfxfuAkuYBkBQ,Ugzz1d2uRCu25XtviOh4AaABAg,0.0,https://yt3.ggpht.com/ytc/AKedOLT1JhwS3oSOd-kLJX5WGSUnN7UgQVmbJjkJ1g=s176-c-k-c0x00ffffff-no-rj,saya senang lihat dan mendengar eprformance mas yang bicara,1 month ago,0
Akifsyah Zainuddin,UCYUED5TGAJPEl8LY9diDAKQ,UgxblxfZy0CZosi2yjl4AaABAg,0.0,https://yt3.ggpht.com/ytc/AKedOLT0LrFJsQf8hwux8k7himrPqkgpuN90em6_GU9n=s176-c-k-c0x00ffffff-no-rj,👍😎,1 month ago,0
Nikanor Surya,UClN928EM_Gv-vRvHT5s0Jvw,UgyFaP6PlvDusZyOgN54AaABAg,0.0,https://yt3.ggpht.com/ytc/AKedOLSydh_gD3XTSTK0FpjL5UwumAHonEnd0dho=s176-c-k-c0x00ffffff-no-rj,lebih fun to drive mana? raize 2021 atau mg zs 2021?,1 month ago,0
Azatasatru Wilogo,UCeGafOgO7jo86nrzpQ7ZAwg,UgygxezfnN_vkgA1oL94AaABAg,0.0,https://yt3.ggpht.com/ytc/AKedOLQuD5wW2HD1QlkUrgWGWQe3an6KuSMWImY-zA=s176-c-k-c0x00ffffff-no-rj,2:32,1 month ago,0
Eka Oktario,UCUYagHwCopjB9ViAoKh0wpA,Ugw-CYsOAFHuWf5Kmix4AaABAg,0.0,https://yt3.ggpht.com/ytc/AKedOLQTw1CdUmFZQ-Vo_5k9NFVg6GCrXW6p-Exta_Fb-Q=s176-c-k-c0x00ffffff-no-rj,Knapa plat nomornya gx di sensor ya. 😅 Tapi banyak reviewer lain yg sensor plat. Sebenernya apa pertimbangannya. ☺️,1 month ago,0
Dell pin,UC-usLpdapZMm2aMko3FtPFg,Ugy5k91L092A2DSKpNB4AaABAg,0.0,https://yt3.ggpht.com/ytc/AKedOLQMvRBP4a_mA9hUMTVd-v3L94gMIcOBZ_AJ0b1O=s176-c-k-c0x00ffffff-no-rj,Doble pndpatan nya dpat kopi lg😂😂😂,1 month ago,0
Fudin Liu,UCJHUagP43qnvGWUs3i_1eUQ,UgzzMiR5iPhpu1gwiS54AaABAg,0.0,https://yt3.ggpht.com/ytc/AKedOLS2-ZLJthyxQr6oUjjCgomfbRKLYO3xX2xnnC8kCBo=s176-c-k-c0x00ffffff-no-rj,Saya berasa harga segitu lbh baik saya beli Honda CRV Wagon atau SUV tahun 2015 sd 2016 harga sekitar Rp.200 Juta sd Rp.230 juta.,1 month ago,0
AR bass Channel,UCBYuenY3JJPwq_eZj3msnQg,UgxLDgoTOLa-s5cJcqt4AaABAg,0.0,https://yt3.ggpht.com/ytc/AKedOLTGZQcH_DjOZNkRQNwqbucRZXF2hOO9b3vMsu3SJQ=s176-c-k-c0x00ffffff-no-rj,"warranty service freejasa dan part, 4tahun atau 50rb km om,,",1 month ago,0
Adang Suherman,UCVhIjszvS-CApQmXgENUFRA,UgxmXb5HxxjCCQ-EKHZ4AaABAg,0.0,https://yt3.ggpht.com/ytc/AKedOLTLJhXPabIuO2eC1E-KOV9hbYa0etKI63AcpEW1cA=s176-c-k-c0x00ffffff-no-rj,Toyota grup akhirnya keluar zona nyaman setelah diobrak abrik wuling dan mobil lain masalah fitur,1 month ago,0
Dewi R_Tunas Toyota Pecenongan,UCy7mSK9DzUe1lorC0WpmcWA,Ugy17DH9Ru1kNG8hlJV4AaABAg.9TefFHytmGn9U453hErmOe,0.0,https://yt3.ggpht.com/xdPUT0HNggvC3VQ4limsANkGyHB5oSPndYd0-Aj17xM-BtEZ0Hwtjoz5Civm7HVeUL3-L6JvZg=s176-c-k-c0x00ffffff-no-rj,Halo kak bisa dibantu untuk info dan pemesanan mobil Toyota nya dengan saya. Makasih 😊🙏,4 weeks ago,0
IRENZEPETO,UC5CpVgMKkDFcQtNh0MPQ72g,UgxnVDC08vdxwA4s0mB4AaABAg,0.0,https://yt3.ggpht.com/lVl30jifGtWgMaf7NP9JQIRKSFcsMA3ZCHpYvkuGD7mwCgo4zm8kvs5QWk2OCyvw_Gax0lRoxt8=s176-c-k-c0x00ffffff-no-rj,1 tombol kosong isi fitur = nambah charge 10jt kata toyota wkwkwkw,1 month ago,0
dengungcom,UCIyTBtPpm_xZC7HitWtzMPA,UgxaXVjMI1TNIl7AH894AaABAg,0.0,https://yt3.ggpht.com/ytc/AKedOLRb59GpbRfREB9dl5zFFr1jJE1GoHA1G4GXNy_zKA=s176-c-k-c0x00ffffff-no-rj,Makin yakin untuk beli..,2 months ago,0
Bayu Kristiadi,UCrw1GJ7YoGbmMVVmqPX6XyQ,UgxOMXiQ5RO-WN6zQ954AaABAg,0.0,https://yt3.ggpht.com/ytc/AKedOLSW9msjaTdp9KVg7kZiC0IVg4IGbP9Qefgt3UP8RA=s176-c-k-c0x00ffffff-no-rj,23:23 Suspensi empuk tapi tdk halus.... terasa kasar saat melewati sambungan jalan...,2 months ago,0
Nissaismenissa Niswatun,UCN5vL96e9TW25ewjlhCzHeg,UgzDkPf1Uc0Gb-ySy5V4AaABAg,0.0,https://yt3.ggpht.com/ytc/AKedOLTzrY1vdEausRFZ4CWLYyv2DMtsmQMAlqFgM-_M=s176-c-k-c0x00ffffff-no-rj,"Om Fitra, mau tanya, apakah kenyamanan mobil raize ini sama dengan Agya dan Ayla. Dulu saya pernah punya dan dipake perjalanan jauh dr Sumenep Madura ke Semarang via Bojonegoro rasanya kok not fun ya. Mohon arahannya, om. Rencana mau beli ini. Terimakasih om",2 months ago,0
Alsha K,UCUXPDZ2OkmF5jZHnqdA3TrQ,UgzE8XdtX5UUxnriDRp4AaABAg,0.0,https://yt3.ggpht.com/ytc/AKedOLSLw9wjjOhnMbx5nms7GtwF4JSO8JzRdzMNvV0=s176-c-k-c0x00ffffff-no-rj,"""Menurut aku""cocok banget buat cewek  yg tingginya 159, buat kerja,jemput anak sekolah, jln jln sama temen gitchuh, emang bener si kalau d pake buat perjalanan agak jauh pati-jogja pati-malang ngerasa kurang nyaman, tapi so far oke la, untuk suami  tinggi 174 kurang worthit si lebih suka pake mobil lain d jarak jauh, mungkin d ciptkn dan d desain lebih ke perempuan cocoknya, lebih elegan juga.",2 months ago (edited),2
TASLIM LAPAGAMBU,UCj5ku0So_DlrUz5dNdTgGyw,UgwloPdXBECnqce61Z54AaABAg,0.0,https://yt3.ggpht.com/ytc/AKedOLR7Rk1WoQcJSDBCjdSq9Ja51kmn1FbS_FWqdPaCWeKPi3qLz4drrcz8R481GeSZ=s176-c-k-c0x00ffffff-no-rj,Toyota Raize,2 months ago,0
TASLIM LAPAGAMBU,UCj5ku0So_DlrUz5dNdTgGyw,UgxL6O6kJRfodwMAVB14AaABAg,0.0,https://yt3.ggpht.com/ytc/AKedOLR7Rk1WoQcJSDBCjdSq9Ja51kmn1FbS_FWqdPaCWeKPi3qLz4drrcz8R481GeSZ=s176-c-k-c0x00ffffff-no-rj,Carbon ia life,2 months ago,0
Am Wish,UCvyAgwoBhbfMiMgIo_E4X9A,Ugzv2eDq69vYfb-1xQR4AaABAg,0.0,https://yt3.ggpht.com/ytc/AKedOLTlJ3yowiXxoKGq4R-h60djMuIji9ApC6k7tQ=s176-c-k-c0x00ffffff-no-rj,Mantap sponsornya Kopi Kapal Api biar Om Fitra tidak ngantuk saat test drive ☕,2 months ago,0
Yohanes Wibisana,UCtZYpgHfZHP8TVbQ5LVyeyw,Ugz7AMV1NiOb_2em76d4AaABAg,0.0,https://yt3.ggpht.com/TTtge7Z4FUJm0nKs4eBMkaLsSCNf9ZnqM3QlwxsGjQg8-uBfmXdtAWM6yilcVfNGRNyRrSz5wO4=s176-c-k-c0x00ffffff-no-rj,0 ke 100 klk di transmisi D dibawah 10 detik om,2 months ago,0
min hogan,UCbjiOsdrX_L-xbt47vV6Vag,Ugzn69_D1yGImGeIj6p4AaABAg,0.0,https://yt3.ggpht.com/IWYTtR4u2H96YKrBCZGDf3Bne5iAm-f5blwoQjStu7GkXakqPD7-kzO37IHSOz5jhwMSGLLAhGw=s176-c-k-c0x00ffffff-no-rj,"10:03 Ini lah getaran2 yg kita tunggu2,",2 months ago (edited),0
Renny Calista,UC0AdPcJf-vComlQwSpG2KLQ,UgzMBxF1GeNc-HszxNN4AaABAg,0.0,https://yt3.ggpht.com/ytc/AKedOLQg0b6DF9pu1PNrj5hqE87RNtfmVv8-cvL6pc_FYIXissoucHyPEDoNDuHtuyM2=s176-c-k-c0x00ffffff-no-rj,Suatu saat kupunya mobil ini...mimpi dulu🙏😘,2 months ago,0
Faizal Yusuf,UC8zY-5aHZQfGlaEcr1q0Heg,UgwVOGuGsnpqIZGVgbl4AaABAg,0.0,https://yt3.ggpht.com/PjELIcuAmQrxdRY7IH3yIoQ4gpIEmXhtPROBO9kh8CrUOi_ewY2bX5d0n9G3yveAg3R0PW4kjA=s176-c-k-c0x00ffffff-no-rj,Request Type G om,2 months ago,0
Jack Martin,UCscxDicworRzlsqvVZZn6kw,UgyPg47t9-_ls-LEVqZ4AaABAg,0.0,https://yt3.ggpht.com/ytc/AKedOLSMlizO6LTExwqMSIpuew9gYjsJjt1O2D6kzqzBDc5pB-fjDnPOKx-Wi9lT5tUs=s176-c-k-c0x00ffffff-no-rj,"Sama sprt Avanza, Rush, Agya, Calya semuanya Daihatsu, hanya pakai emblem Toyota",2 months ago,0
Tommy Lim,UCvBkYidQ0EpT77QSWdZWAYg,UgwTO8D839kNjR1BAop4AaABAg,0.0,https://yt3.ggpht.com/ytc/AKedOLRKxs3PyzjKOTyTVMNkSxreRu14oqJxynI5XHe-=s176-c-k-c0x00ffffff-no-rj,"RAIZE INI FWD ATAU RWD? 
Tolong bantu jawab",2 months ago,0
Agus Maryono,UCWPLpJdbax4vCQk9_v9kyGg,UgyX6DlJTXCgtkhXEaB4AaABAg,0.0,https://yt3.ggpht.com/ytc/AKedOLTgREZJY10OvcV_70r3_uH4mWzb8GBL3YqkRw=s176-c-k-c0x00ffffff-no-rj,Ford ecosport 1.0 turbo 2020 https://youtu.be/Zj6JfOEVkG0,2 months ago,0
Achmad Kahfi,UCkWsWv5pGSqQ2wzqPW-4Unw,Ugxc4TzxtrKNQ4Rkwsh4AaABAg,0.0,https://yt3.ggpht.com/ytc/AKedOLRfy7LeBwx77TGqAZ2agyE0BlpKJs6ja26cw8gwl3VVnjw6LNSuOXRnrkLipg0u=s176-c-k-c0x00ffffff-no-rj,"iklan youtube, iklan di konten, makin banyak ya iklannya pak, hehe",2 months ago,0
Mr.D,UCB5yPUZEj2GCJtO6EbI-D3g,UgzHsBJ7YVZgMovLoGh4AaABAg,0.0,https://yt3.ggpht.com/ytc/AKedOLQFz4DtcBbv48eKpq65OVg-tnh-hHfPUZ6qcEVzgQ=s176-c-k-c0x00ffffff-no-rj,"Yg paling mengganggu adalah 3 silinder nya sih, kesan nya kaya LCGC",3 months ago,0
ad1kurniawan,UCZaMyba0wPGlUm1l5WkqLtg,UgyIcyrWLoT5F-Uhi8d4AaABAg,0.0,https://yt3.ggpht.com/ytc/AKedOLQx8RHI2tnGPwVtWDjBvlh06iqKik8vGfm_MEJZ=s176-c-k-c0x00ffffff-no-rj,"Om, ud lama ga bikin video tentang raize/rocky lg nih. Bandingin yg 1000cc turbo n 1200cc dong om, dr oktan bensin, fitur, keiritan, spek, drag race, dll. Tq",3 months ago,0
Vinny Jap,UC3iGSr_sLAlnGC4ZiuAu54w,UgyrNSn87fpW7c7os-N4AaABAg,0.0,https://yt3.ggpht.com/ytc/AKedOLRUtUGTLHrqcUzoDcn4tArRPEukPSplDuMUd8_mpQ=s176-c-k-c0x00ffffff-no-rj,"Yang 1200cc Matic, 4 cylinder mesinnya ?",3 months ago,0
Stefanus Adi Tirtoadji,UCitxI7HmNOa9NAdF-crXJZA,UgxUXT32X70wbEn1rQN4AaABAg,0.0,https://yt3.ggpht.com/ytc/AKedOLQt6dx1Tcpaziyuan3t5PUgvqW89gFfRkZC5_vifSI=s176-c-k-c0x00ffffff-no-rj,Nabung.. nabung... 😍😍😍👍👍👍,3 months ago,0
Dewi R_Tunas Toyota Pecenongan,UCy7mSK9DzUe1lorC0WpmcWA,UgxaXVjMI1TNIl7AH894AaABAg.9SjgTAM3ZH89U459pOOh5T,0.0,https://yt3.ggpht.com/xdPUT0HNggvC3VQ4limsANkGyHB5oSPndYd0-Aj17xM-BtEZ0Hwtjoz5Civm7HVeUL3-L6JvZg=s176-c-k-c0x00ffffff-no-rj,Halo kak bisa dibantu untuk info dan pemesanan mobil Toyota nya dengan saya. Makasih 😊🙏,4 weeks ago,0
Tiara Rizqy,UCglwgO_hLgvQ_S6ntHpZnAg,UgzE8XdtX5UUxnriDRp4AaABAg.9SV70AKUts19Sgjta9Wx5h,0.0,https://yt3.ggpht.com/cyukVkbkKzbhrTFgFf5cgTO8jqTO2eMzG2-nHlrk9bj5CjYgJCzkFD0LXKhSpBSB-MPTpG7XyQ=s176-c-k-c0x00ffffff-no-rj,Betuuuul teh cocok buat cewe. Aku kemarin ngerasain duduknya aja pas banget,2 months ago,0
Reza Yanglain,UCvXPa0RTTFWTbQMn_C116-w,Ugx6o7fGIQj61azJHSl4AaABAg,0.0,https://yt3.ggpht.com/ytc/AKedOLSxdGLjmsZRIBAcGaXZIV0z67isTczwbXQj0Q=s176-c-k-c0x00ffffff-no-rj,Fix beli 😁,3 months ago,0
Benk Beng,UCH7Wv-qDHzxIv-JIQTN_Xrg,UgxV-bt3RjJPfqrDJZN4AaABAg,0.0,https://yt3.ggpht.com/ytc/AKedOLQZLCEhCE47vcjm3X_GGQLaSJx0FqNRW4B6KdZer_mGIa6l0rVJEBAC7PCH04c3=s176-c-k-c0x00ffffff-no-rj,Intinya banyak ga enaknya ya om?,3 months ago,0
ASUS 09,UC61y00KK4ECP_4alwsLhFug,Ugx6HfNq3cLg3fPbvRp4AaABAg,0.0,https://yt3.ggpht.com/ytc/AKedOLTnl-OhMqLYq7lA74-7qaFF6tocLEQDu_csqokTuA=s176-c-k-c0x00ffffff-no-rj,28:27 tin tin mu 🤣,3 months ago,0
Hello KCN tv,UCduY_6S6kDGbj-H9Ut8_LBg,Ugw87JYvFKEyyiGY7T54AaABAg,0.0,https://yt3.ggpht.com/ytc/AKedOLQm5zpYrvRvuA8h6saGzsPDsFnlLKZSsoGTrbOKEQ=s176-c-k-c0x00ffffff-no-rj,Berapa kita belikan,3 months ago,0
Kurnianta Barus,UCuCH4uCmjrMfgU8mFCGZ2zQ,UgyhoAsz5rUAqpQo_rh4AaABAg,0.0,https://yt3.ggpht.com/ytc/AKedOLQdkS_01inagdVrsoOtGygRbAukDPw9ZK4HAuP7=s176-c-k-c0x00ffffff-no-rj,"Yuk kita lihat apakah warga yg suka bilang ini itu terkait mobil 3 silinder akan beli..
Atau karna brandnya, jd gak penting 3 silinder... 😆",3 months ago,0
Catatan hanif,UCCI962a8fZ1rfeGKM5D228A,UgwGdFFWXyvf741_Xnt4AaABAg,0.0,https://yt3.ggpht.com/DPp0XY5EtPJgchJKUavoRvA_cTa6WwvCsHlBe1DwzfGb8Qr3n09jWsRnwzEwws8cM8xFD6Tg2Q=s176-c-k-c0x00ffffff-no-rj,"Nyimak om,, pengin beli ini..",3 months ago,0
Mass Dimmm,UCQ0V7vrREG0z4h4h_FcN-1w,UgzX2N5QSkyr0OMyjuR4AaABAg,0.0,https://yt3.ggpht.com/ytc/AKedOLSTKxC2ujn8MDrhp00j-agUPPJ3amL0FqihKeV2=s176-c-k-c0x00ffffff-no-rj,Info kaca film yg digunakan dong minn,3 months ago,0
"Raul, rfzi",UCjk2KloMa6OiCwgHk7GGiCw,UgzK8K8KTrWWMY_rlNx4AaABAg,0.0,https://yt3.ggpht.com/ytc/AKedOLSqhq8FrzHLbxHzUwyQx0b1LC6WqJEn8YyUFlARLg=s176-c-k-c0x00ffffff-no-rj,Di indo udh keluar belom om mobil merek itu?,3 months ago,0
Abiandarrel 1505,UCy12DLdmq6XwT2NI-mKeBRg,Ugwra5z0RqcRmrNA0vd4AaABAg,0.0,https://yt3.ggpht.com/ytc/AKedOLTkBUF0MjsSqdc1vgzdXUNY369QUall4Nvjgh5jUEbd3MTpkHY1y_UV_REK5b1c=s176-c-k-c0x00ffffff-no-rj,Semangat om fitra bikin channel nya saya juga pengen beli toyota raize 2 tahun lagi🚙,3 months ago,0
Kemal Widdyarta,UCf_cZ_KrJN5kllmnLdHyKVw,UgwL21VeEOaHC_VcMf14AaABAg,0.0,https://yt3.ggpht.com/ytc/AKedOLSchX0x6xDpbxLFXFWRR1ZuGePTQFHbvjHCYA=s176-c-k-c0x00ffffff-no-rj,Beli dah sekarang. Bukan mobil tapi kapal api signature nya 😁😁😁,3 months ago,0
Jungle OfficiaL,UCtEZXZM2JhMY0W_EnVx9dLg,Ugwh7qElc4kanB8Txcp4AaABAg,0.0,https://yt3.ggpht.com/cMHv6vhiWHY9k-nqKm3ItAwqkyo7X9vVIjeuVIhyKywixAlj4r762bIwDehHGQKOKwBq7A9D=s176-c-k-c0x00ffffff-no-rj,Semoga Kita Semua Bisa Membeli Mobil Dengan Pilihan Sendiri || Aaminn Ya Allah Aaminn :),3 months ago,8
Sukuk Hunter,UCfjA8PCxtM8sC6S7t-5k8Ig,UgxGX82jNFPdj-zAULB4AaABAg,0.0,https://yt3.ggpht.com/wQTyD0IXT-YucL38xj4IZDT22ayNWkx4RW-Sr_o0s_xua0IAcTIF1bqjauLRf9LLy8Pem_MSs2I=s176-c-k-c0x00ffffff-no-rj,"Channel otomotif terbaik, dengan Fitra Eri sebagai reviewer-nya yg jg terbaik..",3 months ago,0
Ayu Wandira,UClpCzMaai7wXNSUzrP_jivw,Ugy9gETlUEM3MUfOzxx4AaABAg,0.0,https://yt3.ggpht.com/ytc/AKedOLRecc0HFCjI-4C_uUfeuIHXSE0egTt3LRmh6A=s176-c-k-c0x00ffffff-no-rj,Sayang nya 1000 cc,3 months ago,0
02_Achmad Zeni,UC0AeV7Aq9RTkYKRC4Yj1agg,UgzKGQU7S43W1zQ4wQd4AaABAg,0.0,https://yt3.ggpht.com/ytc/AKedOLTXZgdG32DZ6LBTawzw87y6sa700q-6LzZAC989=s176-c-k-c0x00ffffff-no-rj,Dengan mesin 1000cc Turbo itu do buat nanjak ke daerah puncak/pegunungan itu bisa gak y? Mohon info,3 months ago,0
Khaerul Ihsan,UCODbc-aeyQaryzQaLjcbl-A,UgxMMI2i0epFYveEg694AaABAg,0.0,https://yt3.ggpht.com/ytc/AKedOLQWAkh3i7l2QrD4Vhxwc4D_aZGwlAt1Ilg5MMXd8hY=s176-c-k-c0x00ffffff-no-rj,"Orang Yang tadinya mau beli yaris, eh ada yg lebih murah dan dashboardnya keren nih.... Hahhahhaa Raize oh Raize",3 months ago,0
Amir Hamzah,UCHAbd1mg6qCQbToaLQcst2A,UgxjzCym_3dLPdfX2f14AaABAg,0.0,https://yt3.ggpht.com/ytc/AKedOLRqbb5f6uEP62kCudqe-8Lt2PDSuOVUvCQR1nPuZw=s176-c-k-c0x00ffffff-no-rj,kalau tri elips yg ngeluarin unit...model kek kodok pun bakal lakuhh 🤭,3 months ago,0
ikhsanhabibie2,UCRs4HQxCCrx5Puubc3K--NA,Ugxx8MvSQg5U0Joh2Xd4AaABAg,0.0,https://yt3.ggpht.com/ytc/AKedOLRIkBZu8uPxElmVZP_X8hB7WIJdyhBrabAWVCcCKw=s176-c-k-c0x00ffffff-no-rj,Mobil ini cocok untuk mahasiswa karna irit dan lincah,3 months ago,0
Qadri Qadri,UC0w6rUrf9XUnZieCvBugJqw,Ugw4L3fwqzgCiK1zo2R4AaABAg,0.0,https://yt3.ggpht.com/ytc/AKedOLRex85uLNxL5bLGh5rHklhD7jLKSvmachWRHT39qw=s176-c-k-c0x00ffffff-no-rj,"Pengen beli ignis tapi muncul raize, 
Pengen raize 1.2 tapi 3 selinder
Ignis modelnya anti mainstream mesinnya 4 selinder,
Masih bingun ambil ignis atau raize",3 months ago,1
gita ayu aprianti,UCT4t-mKoZaPyITxaezfYfTw,UgxhaN0KlbfUNt5nBU94AaABAg,0.0,https://yt3.ggpht.com/ytc/AKedOLS5_GxBRciUwrENyx_F7gkPiGpcUqA0geklLrGoNA=s176-c-k-c0x00ffffff-no-rj,Om rekomendasi toyota raize atau nissan magnite ya?,3 months ago,0
Awan Choo,UCI6-GKgyfJQSCXiJd9SFL3w,Ugx_Dbt2pjKhWs8X_4J4AaABAg,0.0,https://yt3.ggpht.com/ytc/AKedOLS7Qzg63wuFZlL0ZoB52t9o_k2WIO-S_r-0sRoOug=s176-c-k-c0x00ffffff-no-rj,"Duu pusing gw, pengen dr GK5 ganti ke ini,",3 months ago,0
mrizky sukardi,UCeWelrppLFZQx59goWmjirw,UgykDz65RCiimmWZtpd4AaABAg,0.0,https://yt3.ggpht.com/ytc/AKedOLQHaUAB3oJuparUsr9H0CPJwFgYHi7EMZlUunbD=s176-c-k-c0x00ffffff-no-rj,review yg berkualitas 👏,3 months ago (edited),0
sdsdf,UCKsQPzAJJ4wa4nVnRuADaOg,UgxKKqADgRcihT3oq3N4AaABAg,0.0,https://yt3.ggpht.com/NArBftpWTgGpeJlwGu-a_8gsAY2R7817OiOvrJbHqos6_bczJD79KEuT4OtUyvjJefTnGdoDEQ=s176-c-k-c0x00ffffff-no-rj,Coba aja 1500cc turbo 300jt an pun pasti laku keras,3 months ago,0
Tomi Sujono,UC82TYpZD-yl-VgG853-Z6pg,Ugwk147ii5fN30Jmy6B4AaABAg,0.0,https://yt3.ggpht.com/ytc/AKedOLRKJUN_z_l06pZS6xb6HZ9i3r-iH9Dvgff8piudpw=s176-c-k-c0x00ffffff-no-rj,Selalu suka sm ulasan om fitra 👍👍 komplit simple mudah di pahami,3 months ago,0
rahardi derri,UCrvzrZRTN2XhUGyIMMM9A5Q,Ugz_-35LsTdhEYz2D5p4AaABAg,0.0,https://yt3.ggpht.com/ytc/AKedOLQ-s3rXTtp2ZBOI0LrMnhl92HqoYdTm9OZSjA=s176-c-k-c0x00ffffff-no-rj,Gapaham kenapa tss di auto2000 indennya sampe berbulan2 sedangkan di dealer lain spt tunas/daya ready stok,3 months ago (edited),0
Gobay Mr,UC54C5Yge4K17y0bjoijcCrg,UgwlSD6jKkT6WFzyJzh4AaABAg,0.0,https://yt3.ggpht.com/ytc/AKedOLRGM0JNU6UfkqZy1xSm78ZYrAtlDz1stUvTlQ=s176-c-k-c0x00ffffff-no-rj,Apa enak nya mesin 3 cylinder kenceng kagak berisik iya tuh mesin  turbo nya jg turbo kw,3 months ago,0
"Amiruddin, S.H.",UCJ1FyzQRDJf4D1ZY9tVZqAg,UgxKVQGbewxbwAHTlQl4AaABAg,0.0,https://yt3.ggpht.com/klt8rvQeB-HcTR3PgLWURasYvzyiJPEKlexbYUAhT6KBCR0dMfQoVGdaH8lWh0_8weJ_RVsbSp0=s176-c-k-c0x00ffffff-no-rj,"Review lengkap jelas, menarik gaya dan bahasa driver reviewnya.",3 months ago,0
Jendri Fitriyanto,UCBagPAKfKmRi6XNnneXqOVQ,UgywLaSl-Cys0i4KOnx4AaABAg,0.0,https://yt3.ggpht.com/ytc/AKedOLTgGgU-l-jlCfAH3fMppXn5ce89YkOsaoElUg=s176-c-k-c0x00ffffff-no-rj,Josss ..mksh bos,3 months ago,0
Rofia Karomah,UCto-ZRT5nVn5J1YtXEWNtEQ,UgwQvuRnnV74gBoZPfd4AaABAg,0.0,https://yt3.ggpht.com/ytc/AKedOLSscD2E4EoRyghn2jzIY3oc3LG5w2VrPigie2kw=s176-c-k-c0x00ffffff-no-rj,"Niat mau beli kia sonet, iseng bandingin sama raize krn liat harga nya walau mesin nya turun kelas, ehhh denger kalimat om Fitra ""kia sonet lebih nyaman & fun to drive"", heee ga jadi dah balik lg ke kia sonet 😂",3 months ago,0
Rofia Karomah,UCto-ZRT5nVn5J1YtXEWNtEQ,UgxThpuSf57K72XLuKx4AaABAg,0.0,https://yt3.ggpht.com/ytc/AKedOLSscD2E4EoRyghn2jzIY3oc3LG5w2VrPigie2kw=s176-c-k-c0x00ffffff-no-rj,Wahhh selama liat semua review om Fitra baru yg ini yg paling banyak iklannya dalam 1 video hihihii,3 months ago,3
Miming wijaya,UC9Vg5A_MHsNMSpEmVG_odzg,UgwHlKKz4y4CICpjcQZ4AaABAg,0.0,https://yt3.ggpht.com/ytc/AKedOLRF-Q9WWhsb7M1Gd3DfNYe1BXwE5K00xfV3-c5QAZA=s176-c-k-c0x00ffffff-no-rj,terlalu bertele tele presentasi nya,3 months ago,0
THUNDER MOVIES STUDIO,UCv800NZVhaxFyvdK_CPp72w,Ugz_36-cr7XxOdSVMXd4AaABAg,0.0,https://yt3.ggpht.com/ytc/AKedOLSzMF3QFp3zsNS_34G7rsMtT0lCk1LYfaRfoAdLkw=s176-c-k-c0x00ffffff-no-rj,Amin semoga bisa ya...,3 months ago,0
Zaky Hilmy Virajati,UC4cJnjX3EJMBMPSbhTchcDg,UgylMvqzkfyNdKm-50h4AaABAg,0.0,https://yt3.ggpht.com/ytc/AKedOLTnKUbR9JN2-XtHs5A65NAIvo_wQnqReMEU0RskPg=s176-c-k-c0x00ffffff-no-rj,"Dang, its quite a big deal that this car picks up ALOT of small bumps :((, kinda big deal breaker fo me",3 months ago,0
