author,channel,cid,heart,photo,text,time,votes
Prasetyo Hermawan,UCHjBRHGNe9tTJEe2KEBYsLA,UgySDY50y88B1ahA_TF4AaABAg,0.0,https://yt3.ggpht.com/ytc/AKedOLTTQDJqpaO8hVlWH3QHq9u0OTLEbj7yMS98p2If=s176-c-k-c0x00ffffff-no-rj,Om boleh gk d tes drag untuk transmisi cvt toyota dan honda toyota Rize vs bRV,5 months ago,0
Boy Channel,UCQ8GrsaWk0ogNuyITxj92dw,Ugy7eyu-G7SU5--qjIN4AaABAg,0.0,https://yt3.ggpht.com/ytc/AKedOLRG-PWl87Mpu3UcThIfb3OhVX1edvtQuV7MmQ=s176-c-k-c0x00ffffff-no-rj,Jadi pr buat pabrikan lain,5 months ago,0
titik indra,UC9OkWsezYFFegingToktC0Q,UgxT08bJSnIDUxDRJA94AaABAg.9O0Wpq3RXxB9O14FyOzfdv,0.0,https://yt3.ggpht.com/ytc/AKedOLQnrjIjmaHFShkhEl98vyWjc0tpK-7T3XzEqw=s176-c-k-c0x00ffffff-no-rj,Brio RS lah...,5 months ago,0
Alexandro Pontoh,UCMIorbpE9MmSwH7_Eujs1Ag,UgySDY50y88B1ahA_TF4AaABAg.9O0GvF056Om9O3hTYZNF1F,0.0,https://yt3.ggpht.com/ytc/AKedOLQ_F7dbWBI82ozexqHU90VHJRf4A624AYvrLAL0Mg=s176-c-k-c0x00ffffff-no-rj,"kalo yaris ama jazz yg sama"" cvt lebih rsponsif yg honda punya sihh",5 months ago,1
Prasetyo Hermawan,UCHjBRHGNe9tTJEe2KEBYsLA,UgySDY50y88B1ahA_TF4AaABAg.9O0GvF056Om9O3nA6Ynf8j,0.0,https://yt3.ggpht.com/ytc/AKedOLTTQDJqpaO8hVlWH3QHq9u0OTLEbj7yMS98p2If=s176-c-k-c0x00ffffff-no-rj, @Alexandro Pontoh  buat videonya lebih mantap,5 months ago,0
Azrai Wazza,UCufGzt5PM6su-xbL-d-nEhQ,UgwFvsjxPN2VDPqamyd4AaABAg,0.0,https://yt3.ggpht.com/McONV_cQJbeAZwE-2P5ZSs6x5O7BiUinYw4Q9M7cbQdPDuIMFm-KsMlS6wHIVHKX-7sNKnA6pA=s176-c-k-c0x00ffffff-no-rj,Perlu pasang turbo timer gak sih?,5 months ago,1
Zein On,UCLROJ1pTxYTwDM5rIicCGLg,UgznQVfmJVOGxtprZNZ4AaABAg,0.0,https://yt3.ggpht.com/ytc/AKedOLTPj9VmnvfMyL6eTWhD8zKZs5RuxBXJECEfAwLSdg=s176-c-k-c0x00ffffff-no-rj,Om Fitra Kyaknya Bajunya Warnaya itu² aja😁,5 months ago,0
Enzo Bologna,UCiFG-RxTyPtz8rejgG1wF1g,UgyeuoRAF-Z5uv9CbFd4AaABAg,0.0,https://yt3.ggpht.com/ytc/AKedOLRdiEaS1K1MdaSXDQQvlbJZCExhHOiQ0rkZzA=s176-c-k-c0x00ffffff-no-rj,Jadi pengen belliii... KIA Sonet,5 months ago,0
Andiko Alif,UC0346Ox1clTX7Uak-T2b2Pg,UgwVxQ8FMdr9oj4sxBp4AaABAg,0.0,https://yt3.ggpht.com/ytc/AKedOLTDZqGmKJ5jlIX4X-KvHfm7g1sl_2iXaRG5Y06wlA=s176-c-k-c0x00ffffff-no-rj,"Wow, soft selling sekali sepertinya Kopiko😂",5 months ago,0
clemen clemen,UCHi1Ll8pfSpFeK8PAk_GcrA,UgyjyZx0k98yRT-qyWB4AaABAg,0.0,https://yt3.ggpht.com/ytc/AKedOLRouERrPcWpWrtfou9mHnyJv8dhvzZdwvbi0A=s176-c-k-c0x00ffffff-no-rj,material interior ny..:),5 months ago,0
Mandry Raharto,UCB4OT6__v3akzZSO7mpmfzA,UgwHYBzJQ6ndJe-JQ1p4AaABAg,0.0,https://yt3.ggpht.com/ytc/AKedOLQe7-6AKAS_CaZwG7OBQIGyyS3dhQ2dSjKOF1vcyQ=s176-c-k-c0x00ffffff-no-rj,kenapa ya klo mobil fwd berasa nungging dibanding rwd,5 months ago,0
Teuku Andi Kurniawan,UClhuoI7yAGkyaowiR9ulpbQ,UgymV30saxdSiPRsxHR4AaABAg,0.0,https://yt3.ggpht.com/ytc/AKedOLSZQZpENMryFMNVDsdWKHxNuTZqUQFgfFTcf7VRhQ=s176-c-k-c0x00ffffff-no-rj,"Setelah nonton review ini, jadi pengen beli kapal api",5 months ago,0
Titus Rahadi,UCrYzp1BTUEj5dfgeO94GiAQ,UgwSTgFjs7R0a_D41Z14AaABAg,0.0,https://yt3.ggpht.com/ytc/AKedOLT3NU7FUhZiVn1A1wE0lH95MQ6mFHyr3u9KXpT5fA=s176-c-k-c0x00ffffff-no-rj,Udah mondar-mandir di ring road Jogja 5 hari ini,5 months ago,0
Bang Israni,UCaDYEWV-kpN9bdZE9edIDKw,Ugy6V0FC1RC3KL0Sc0x4AaABAg,0.0,https://yt3.ggpht.com/ytc/AKedOLS0sFyxirnExozUKOtAvki7g0rMRr1pBThfkg=s176-c-k-c0x00ffffff-no-rj,Dan di caplok Oleh Perodua perusahaan Mobil dr malaysia.. setiap keluaran mobil toyota dan ada beberapa Merek dr Daihatsu contoh nya Daihatsu Ayla juga ikut di ubah logo menjadi Perodua Axia kan ngakak Njirr 🤣🤣 itu di buat logo Perodua khusus untuk Warga malaysia biar dikira buatan mereka sendiri😂😂😂😂😂,5 months ago (edited),0
Yan Btp,UC_yBeAxmvElo74DGiUDCW5A,UgxTsqWv4jSs1rIvLBJ4AaABAg,0.0,https://yt3.ggpht.com/ytc/AKedOLTVgW5krbpbkeGBKxDOeAFU1nmlyf9NdRGZEQ=s176-c-k-c0x00ffffff-no-rj,Duh rasa daihatsu itu konotasinya gimana om...?,5 months ago,0
ALFANDY SAGALA,UCMRLsJN80W5ELSRegRBfYMg,UgxmXgUMGM4n1Pd5iLt4AaABAg,0.0,https://yt3.ggpht.com/ytc/AKedOLTAnYFX4o_Zt-6F2A1L5bc3uLClDc_ZxKB4595Q8A=s176-c-k-c0x00ffffff-no-rj,Pas ngomong teleskopik napa ditarik2 gitu om fitra. Kan cukup bilang juga kita percaya,5 months ago,1
Pondok Hidroponik,UCMCU2iGycUnGnHqiNhP8PUg,Ugy7bFprD0YLbX8VyNd4AaABAg,0.0,https://yt3.ggpht.com/SGF1ncpa3Aba-FbYSpncEXmZTU2V9iJOt5UiXcBtr7VzFCgkKVZghhD6zCDuDW4rAUyxzSCdv10=s176-c-k-c0x00ffffff-no-rj,Kenapa milih toyota raize om di banding wuling almas.??,5 months ago,0
Fatih Raqilla,UCo4MigHSkNDUiar5WicJrQw,Ugy4aaOCYuQ0XgXMe3J4AaABAg,0.0,https://yt3.ggpht.com/ytc/AKedOLRy7QYERuML9f-D7PdBvajt1NZHDEZtWi5WYA=s176-c-k-c0x00ffffff-no-rj,Toyota raize pelek nya warna hitam keren banget 👍,5 months ago,0
mas cemong,UCL8AgaxsfQY7PBv1VtEtc_Q,Ugzize8eqHXYaobEMNl4AaABAg,0.0,https://yt3.ggpht.com/ytc/AKedOLRs7h4oYABJuzZQdke5ve7o883eQwSveZMa0gHEoA=s176-c-k-c0x00ffffff-no-rj,Buat celen,5 months ago,0
Hendra sobaro,UCGA82hrD9BxdYpv6FiXAU_A,UgwBbbhRwuZ4usmH4vZ4AaABAg,0.0,https://yt3.ggpht.com/ytc/AKedOLTy5-vM4KWKUCg9VaF8LHTOYvD2yLk_pLDT87Xi=s176-c-k-c0x00ffffff-no-rj,Avanza killer ???,5 months ago,0
Nicho Krisna,UCOHep44CKvZDN9VHnD7KBww,UgydreOcziBuRpZJBup4AaABAg,0.0,https://yt3.ggpht.com/ytc/AKedOLShKT2tVz_yU8PLj1Rdk0buPME-VUovN2ixOMJAIA=s176-c-k-c0x00ffffff-no-rj,"penasaran konsumsi bahan bakarnya di kondisi stop & go macam jkt & sby waktu berangkat/pulang kerja..
agya 1.0 (3 cyl) matic aja paling bagus cuman dapet 1:9 (full to full)",5 months ago,0
Rifqi F,UCaxubrBfafAv5evRV0g9WOA,Ugw8kZCOJqvSfu3Flf94AaABAg,0.0,https://yt3.ggpht.com/ytc/AKedOLRROOLnRv0gbNHLJ6yo6wQqA1-uu6zeRzlXpw=s176-c-k-c0x00ffffff-no-rj,"Bantingan nya tidak dewasa, menghibur, bahasa cm denger dari Om Fitra...😁👍",5 months ago,12
markus Hdn,UC0-qHezwyV7tmtS01tZ-EUw,Ugz_5Z4sQ0cAySmaCCh4AaABAg,0.0,https://yt3.ggpht.com/ytc/AKedOLSNjqs1UrtAmd9QRRqxTKOmay2xKpJpQCmzdMK6=s176-c-k-c0x00ffffff-no-rj,"kalau kondisi malam (jarak pandang pendek) dan kondisi cuaca hujan berkabut, apakah sistem Radar/ ATC berjalan/berfungsi dengan sempurna?",5 months ago,24
Christiawan Adiputra,UCgcy9rKzZMzrk84q-_6n_lw,Ugym-aq8e1mRRA8sHK94AaABAg,0.0,https://yt3.ggpht.com/ytc/AKedOLSs0-6uQ-AZi0OMSTzb63I8JZr4ztwUZLtolNLAy8Q=s176-c-k-c0x00ffffff-no-rj,kok menurutku jelek ya?  biasa aja gt,5 months ago,0
Sindu Hartanto,UCD283ZBqFc30wtl-a3tMumg,UgzAydil5nwprywomv14AaABAg,0.0,https://yt3.ggpht.com/ytc/AKedOLQYiGBKUtKumC87a9yJXu7LaPli4G2evIt_VKrg=s176-c-k-c0x00ffffff-no-rj,Saya nunggu yg 4 cilinder .....,5 months ago,0
Keep Dodol,UCaiYXxc_KrdBvRDeQQ_uzSQ,UgwHYBzJQ6ndJe-JQ1p4AaABAg.9O04Jkuba179O2ZQrEdem2,0.0,https://yt3.ggpht.com/ytc/AKedOLSUqpK6ZNrK0sNOS0OJRpbUgMmzoYcYsGNd4p_4=s176-c-k-c0x00ffffff-no-rj,"Kijang jantan, lebih parah nunggingnya padahal RWD",5 months ago,0
eXeL99,UCIb-mZYpNK_061ErdcE7WdQ,UgwHYBzJQ6ndJe-JQ1p4AaABAg.9O04Jkuba179O7HgYUeuUc,0.0,https://yt3.ggpht.com/ytc/AKedOLSwf179c4iBl8COUCqwkKznqu-5UUmSHCM6EE0rrw=s176-c-k-c0x00ffffff-no-rj, @Keep Dodol  Hahaha.. mobil ayah saya dulu (kijang super) jg sama. Sampe suspensi belakang diceperin dikit biar agak proporsional.,5 months ago,0
Lucky889 S,UCRbTsfernyKSpPbVaMR9E_w,Ugy6V0FC1RC3KL0Sc0x4AaABAg.9O02dEafVl59O5ef6MDUpA,0.0,https://yt3.ggpht.com/ytc/AKedOLSKGVqXXC5v0aLgAITVDUCMWwwWGh_fZOFi3g=s176-c-k-c0x00ffffff-no-rj,"Bukan. Itu Uda perjanjian kerjasama Daihatsu sama Perodua. Gak ada caplok caplokan. Daihatsu buat mobil, Perodua pasarin jual. kalau gak gitu, Daihatsu gak bakalan gede begini di malay. Gak ada merk Daihatsu kan di sana? Kayak Timor aja. Org Malay juga tau itu asal Daihatsu kali, bisa google juga mereka.",5 months ago (edited),0
Bang Israni,UCaDYEWV-kpN9bdZE9edIDKw,Ugy6V0FC1RC3KL0Sc0x4AaABAg.9O02dEafVl59O6k1o5oKfa,0.0,https://yt3.ggpht.com/ytc/AKedOLS0sFyxirnExozUKOtAvki7g0rMRr1pBThfkg=s176-c-k-c0x00ffffff-no-rj," @Lucky889 S  lah bagaimana dgn Toyota ..apa toyota kurang laku juga di malaysia..sehingga Perodua harus meletakkan logo mereka di Toyota Alphard  dan toyota yg terbaru ini..apa pendapat kamu.....setau gua..pengalaman gua yg stay di malaysia selama 12 tahun ,semua produk jepang tumpah ruah di malaysia hanya saja produk Korea seperti Hyundai dan KIA sangat langka.. apalagi merek toyota seluruh dunia mengenalinya. Jadi apa pendapat kamu Kalau logo Perodua juga di letakkan di Merek2 mobil Toyota. ???",5 months ago (edited),0
Bang Israni,UCaDYEWV-kpN9bdZE9edIDKw,Ugy6V0FC1RC3KL0Sc0x4AaABAg.9O02dEafVl59O6kVM9QeTS,0.0,https://yt3.ggpht.com/ytc/AKedOLS0sFyxirnExozUKOtAvki7g0rMRr1pBThfkg=s176-c-k-c0x00ffffff-no-rj, @Lucky889 S  dan perlu di ingat...mereka memang tau produk2 mobil perodua adalah keluaran pabrik Daihatsu..akan tetapi mereka tetap mengakui nya sebgai buatan anak bangsa mereka sndiri..yaitu hasil produksi perodua 100%. Dan pertnyaan ini sudah sering sy tanyakan langsung ke member sya warga malaysia..  kan ngakak njirr🤣🤣🤣masa produk jepang di akui produk mereka😂😂😂,5 months ago (edited),0
M Ahsan,UCRR0CuuJ_dXU_XLzsbvKczw,UgxmXgUMGM4n1Pd5iLt4AaABAg.9O-rf3TIm359O19wGBGs-l,0.0,https://yt3.ggpht.com/_7w98l6mIr0L9Wx4vmbMsLLsRFlAHW-FiSL8eqgPbUp5dWXneJnEFH_wgVnc6LcXIPANDHTZ=s176-c-k-c0x00ffffff-no-rj,"Agar bisa memperlihatkan kpd viewer, seberapa banyak travel / jarak main dr fitur tsb.",5 months ago,0
Ryan Edsa,UCZPdTxDnOGtQFKIqLSW8irQ,Ugy7bFprD0YLbX8VyNd4AaABAg.9O-rbwJ5u6o9O-xRfSz-S6,0.0,https://yt3.ggpht.com/ytc/AKedOLTD9Uqw61pCBryqePpFcokhRPsYZPgz7t__tewFtw=s176-c-k-c0x00ffffff-no-rj,"Naah ini juga yg jadi pertanyaan saya,untuk fitur lebih banyak almaz.",5 months ago,0
mr. h channel,UCRItzCol6VFHHbDH0nHykzQ,Ugz_5Z4sQ0cAySmaCCh4AaABAg.9O-iha7TBft9O6tKxtaa2q,0.0,https://yt3.ggpht.com/ytc/AKedOLTWxbY__AuB556owrN1_uX2eXQJBjy3YvwvRjZc=s176-c-k-c0x00ffffff-no-rj,pertanyaan bagus,5 months ago,1
Eric Halim,UCW1LtUId-GJdXpWuIpo7n9A,Ugz_5Z4sQ0cAySmaCCh4AaABAg.9O-iha7TBft9O7kZJ9bI_6,0.0,https://yt3.ggpht.com/ytc/AKedOLRakrp7rCgFkwuhrKG4BSjswuF9ISV02XsNTCPiuA=s176-c-k-c0x00ffffff-no-rj,Lebih Aman disetir sendiri,5 months ago,1
Davit Alex Sander,UCozmmyr3bkBUG2nFZuOQ_Lw,UgwVAi4BL9mhD7rvG2t4AaABAg,0.0,https://yt3.ggpht.com/ytc/AKedOLTgkIsMlsja_tLeF7OXEVwCK0_2SbUqZOE4cvy_=s176-c-k-c0x00ffffff-no-rj,"Walaupun terpaksa, ttap nonton iklan haha",5 months ago,0
Cuci Mata,UCvnDUxtXKG4FduiIqxx0QQQ,Ugw0VnIJDrysh9tlCwB4AaABAg,0.0,https://yt3.ggpht.com/ytc/AKedOLQD9V390WxEiVYY3sQK2i4u0lvVBjaSbWdXf8CB8A=s176-c-k-c0x00ffffff-no-rj,Pasti mitsubisi latah,5 months ago,0
JEPP,UCsV_7Bz4422OFPIRXC4IHBQ,UgyUKb9bvmUJGeuHSml4AaABAg,0.0,https://yt3.ggpht.com/ytc/AKedOLSpJtalkWt1qC_XoH928qLho6K1xrh5XWjzBOaM=s176-c-k-c0x00ffffff-no-rj,"26:26
Sudah jelas Mas Fitra Eri lebih suka driving Kia Sonet. Dan ntah berapa x kita simak mas Fitra ngomong biasa saja/basic sepanjang review toyota raize ini. 

Cuba bandingkan ketika beliau review Sonet,penuh pujian kepada sonet.

Lantasssss...whats wrong with KIA SONET?
Apa yg membuat beliau membeli raize? 
Se spesial itukah TSS nya raize sehingga kelemahan yg lain bisa dilupakan diabaikan?

Ini misteri yg besar.............",5 months ago,0
geRy cho - cho,UCNon69w2SKNYKpj71vwH-cA,Ugxs_5wtzP1g0bNOtGF4AaABAg,0.0,https://yt3.ggpht.com/ytc/AKedOLSy-pOFp95yf15aCoi7rKOKZpEisoZBUPsxt-WK=s176-c-k-c0x00ffffff-no-rj,"Kopinya kyknya mantap om, hhhhhh",5 months ago,0
Agus bboy,UCV_brukzAwYm6OYVIVVQT0g,UgxwvXrg6oJt-R9CVq14AaABAg,0.0,https://yt3.ggpht.com/ytc/AKedOLSzv7CcmwcEpJ9U62FpacuZgNCIq6XIW2W4-w=s176-c-k-c0x00ffffff-no-rj,Mehong 😕,5 months ago,7
wisnu gree id,UCISc2tU1Pk-aqGOtsj5Uv_w,UgwrsAu8hWV5CoZAwnR4AaABAg,0.0,https://yt3.ggpht.com/ytc/AKedOLQhEU32nD2ECjf2DhZ6EBC6O2gYc8pJ2nLYbslt=s176-c-k-c0x00ffffff-no-rj,Bagus kalau jadi mobil listrik,5 months ago,0
Artisto Adi Yussac,UC3910-jWrI-UsVnjWc5s01A,Ugyr7B8aXz94J06tta54AaABAg,0.0,https://yt3.ggpht.com/ytc/AKedOLR-_Yh6yzXJeu7z-9qDYujiIbf4ytfuTis7yLdz=s176-c-k-c0x00ffffff-no-rj,"Mas Fitra, kalau berkenan mohon bisa dibuat video perbandingan dengan KIA Sonet dong.....",5 months ago,0
Riska Nurandriani,UC9K_8Tpm_gim4JNM8F0N16Q,Ugx-jY7ccjZHLdD63-N4AaABAg,0.0,https://yt3.ggpht.com/ytc/AKedOLTVT_5_CPjYltLG1UPX0t6dPtFFIiqy8EilxQ=s176-c-k-c0x00ffffff-no-rj,bismillah 2022 bisa punya sendiri toyota raizenya,5 months ago,0
Septian ade Purnomo,UCTMwC0aZPn0HhvsN21Gvnbg,UgwTI7Z12uXHo3R_jgx4AaABAg,0.0,https://yt3.ggpht.com/ytc/AKedOLTxCEyvfBoP6j3IDtg42gBGQNorptx4I6I7Xd-O=s176-c-k-c0x00ffffff-no-rj,Keren sponsor kapal api. Review kapal api (kapal laut) yg pakai 🔥,5 months ago,0
ɠαlμɦ GPS,UCBWLO-eo5AGuPygJh4nsrPg,Ugw4gozCr9_Vou2ryAB4AaABAg,0.0,https://yt3.ggpht.com/ytc/AKedOLS6dpRDfTZljD6ZgAQ6QVplLhKeU-2JD4OYtejy=s176-c-k-c0x00ffffff-no-rj,4:21 mirip 🤔 apa ya,5 months ago,1
McLeonz XXZ,UCB_J161-vdr52GWTeJbx0jA,UgznGngVHYRMcoWsUU14AaABAg,0.0,https://yt3.ggpht.com/ytc/AKedOLQ3WVO0B5nc9ryJN2veu3i_OkTAhLfqEu8_XJuMoA=s176-c-k-c0x00ffffff-no-rj,30:16,5 months ago,1
Andy Nurhatta,UC9kEj0ApIgGVW7gXGe7b2OQ,UgwXLsGNXgDSmIPWF4p4AaABAg,0.0,https://yt3.ggpht.com/ytc/AKedOLS2WDZ_QRgVMBG8qIvL6XhdmK1fufGf1Y5OwQ=s176-c-k-c0x00ffffff-no-rj,"Om Fitra, Raize boleh ya diisi shell nitro+ ron 98?",5 months ago,0
Tech Ant Life,UCq-9X6lxb_4nxX0okqtbqnQ,UgxMLq1bmH1no321Xlp4AaABAg,0.0,https://yt3.ggpht.com/ytc/AKedOLS4vcVk__rt8PVwK3jSkCbNV4B9Pfuu0RyJpEr29Q=s176-c-k-c0x00ffffff-no-rj,"Widih cuan semua nih, ada 3 iklan masuk dalam 1 video.
Hebat tim nya otodriver 👍",5 months ago,4
Aji Saibani,UC_yQaXtDTGwaANdxAI7liew,UgwEHTC66A6qzCiK8Ud4AaABAg,0.0,https://yt3.ggpht.com/ytc/AKedOLRAjiImX1imeoXfrax3X2LXLJDtjWgEh6Lhnv5A=s176-c-k-c0x00ffffff-no-rj,Lampu belakang nya mirip rush/terios ya,5 months ago,0
Kadek Toni Mulyawan,UC7FlhRY8tL4Q7h755Tq3x5g,UgzWxtmkByxRvDjZ1uV4AaABAg,0.0,https://yt3.ggpht.com/ytc/AKedOLQlcR9q3FsQxgmvbTGfMOMykDLYSu43f2AX9L2p=s176-c-k-c0x00ffffff-no-rj,Duduknya bisa lihat disini? 😂,5 months ago,0
Garry Septian Saputra,UCuCszAN95bfBnwD53zwQU_g,UgwrUPNSmWuWzYT_nfN4AaABAg,0.0,https://yt3.ggpht.com/ytc/AKedOLSYOwwszUAPSsJp5jnD_fbGEm2YjKoOZzR2bA=s176-c-k-c0x00ffffff-no-rj,Lihat harga dan fitur TOYOTA RAIZE bisa kita simpulkan bahwa TOYOTA AVANZA VELOZ itu adalah kendaraan yg terlalu OVER PRIZE,5 months ago,1
Beebo Toding,UCg8QexnebaU-geHK1S-goOA,UgwUgeScS0wSe33fgdV4AaABAg,0.0,https://yt3.ggpht.com/ytc/AKedOLSJZjq2Z6zzLqW2JS_hLu8IWx094qdMQQYKIg=s176-c-k-c0x00ffffff-no-rj,"Bagus , tdk bagus ,. Pusing dgrnya mo bagus ya beli mobil harga 2 milyar",5 months ago,0
Eko Cahyono AVO,UC3Zf7OpMcSeooX8blgP2OhQ,UgysWqpO1IJMdwGsYyh4AaABAg,0.0,https://yt3.ggpht.com/ytc/AKedOLShxVYBAsbhuY7CQov9oj0MB3zA7WTfQkMsHEwd=s176-c-k-c0x00ffffff-no-rj,mobilnya emang murah bagi yang punya uang,5 months ago,0
Anthony Liang,UCITxCjmxsKh8wsu8-ddUTMg,UgxqBMhy4JO4noZFfBl4AaABAg,0.0,https://yt3.ggpht.com/ytc/AKedOLRGw2C5_z1yv-fcrvEpiH8YLD-xItiJiaOYIZVH8A=s176-c-k-c0x00ffffff-no-rj,Dpn lbh mnarik rocky,5 months ago,0
Gen Legowo,UCl7zxNXFUVu9ffWGoM39JBg,Ugyp4YoYiSDXZmX0iux4AaABAg,0.0,https://yt3.ggpht.com/ytc/AKedOLSxFfWwaFjVpgvj7tj2SG1bhqAEsDcLeNjQow=s176-c-k-c0x00ffffff-no-rj,Enak mana ya sama Yaris terbaru,5 months ago,0
Rizqi Vergara,UCYH7dPCeuLOFmAw-idPJK4Q,UgxwvXrg6oJt-R9CVq14AaABAg.9O-PpEMYZMi9PS__Y737Tj,0.0,https://yt3.ggpht.com/ytc/AKedOLQpRjITV0Fd7nyocx6_j6NiJbgnwMRPIbdwPoWbvw=s176-c-k-c0x00ffffff-no-rj,Mau murah ada LCGC,4 months ago,3
M Ahsan,UCRR0CuuJ_dXU_XLzsbvKczw,UgwXLsGNXgDSmIPWF4p4AaABAg.9O-Eaga_lHW9O19RVsDs0w,0.0,https://yt3.ggpht.com/_7w98l6mIr0L9Wx4vmbMsLLsRFlAHW-FiSL8eqgPbUp5dWXneJnEFH_wgVnc6LcXIPANDHTZ=s176-c-k-c0x00ffffff-no-rj,Diisi dexlite pun boleh,5 months ago,0
Darien Torino,UCFxmpU_rvmAMh44UsQ7lW6A,UgwrUPNSmWuWzYT_nfN4AaABAg.9O-5d-GcOHX9O1C2DQsWiW,0.0,https://yt3.ggpht.com/ytc/AKedOLR8Eybyq-0nf5kyH1ciB9FPUBkTJM-sD8FQ5g=s176-c-k-c0x00ffffff-no-rj,Overpriced om😁,5 months ago,1
Extremely juicy,UCaivBAaODPFwQsyBl62UcXw,UgwUgeScS0wSe33fgdV4AaABAg.9O-4uowutUM9O-A1JjAM--,0.0,https://yt3.ggpht.com/axkNBZHUfj1B5tOiZbSMoLk7waMOTcBn_exp9EzlGvC1HrGF8vJA7MtZNJOaL-WSmrRvMJG_sA=s176-c-k-c0x00ffffff-no-rj,"kebiasaan kaum awam yang tidak tau safety sense, taunya nama doang, fiturnya ga tau",5 months ago,0
Extremely juicy,UCaivBAaODPFwQsyBl62UcXw,Ugyp4YoYiSDXZmX0iux4AaABAg.9O-3gg0NC_Y9O-A2hiZLok,0.0,https://yt3.ggpht.com/axkNBZHUfj1B5tOiZbSMoLk7waMOTcBn_exp9EzlGvC1HrGF8vJA7MtZNJOaL-WSmrRvMJG_sA=s176-c-k-c0x00ffffff-no-rj,beda segment,5 months ago,0
Ladies Fighter,UCjpb_VTxrb6Yt1WonYgkH8Q,UgxQiNK8j5CLespQ5-F4AaABAg,0.0,https://yt3.ggpht.com/ytc/AKedOLThT79Em_26_g7QLeSFv7jVpG_uUvKpIX6v1w=s176-c-k-c0x00ffffff-no-rj,Mobil impian gua,5 months ago,0
B3wox Ampera,UCx5xs9b8cALv52ypi_Y-2bg,UgwsYNtfU0ECK68WH-h4AaABAg,0.0,https://yt3.ggpht.com/ytc/AKedOLR8DEw1pmqEt1P3rW80gop6EqH-jSg2KOV6s7Of=s176-c-k-c0x00ffffff-no-rj,Pesan sponsor yg di masukkan di vlog ini di kemas pas dengan kebutuhan materi vlognya dan halus sekali tdk terasa pesan sponsor. Mantab Oto Driver,5 months ago,86
Achmad Nafiudin,UCOwh8_8-AJkwen-q4LgLdmg,UgweNwsY0pH3lksn4dl4AaABAg,0.0,https://yt3.ggpht.com/ytc/AKedOLTUheV0l7uYjZcm0LsSBt4_7UcGCCFI_jsH4Q=s176-c-k-c0x00ffffff-no-rj,Sebentar lagi sonet improve adaptif Cc,5 months ago,0
Sam Tan,UCVEEb2wongKaFzPDI5VpF7A,Ugz-v6H0gCIVu6-EilF4AaABAg,0.0,https://yt3.ggpht.com/ytc/AKedOLQ4LcdpCG_l0FlVrxofBHWQrRioI-Y2s2Uw4GRx=s176-c-k-c0x00ffffff-no-rj,"buat budget dibawah 300jt utk mobil keluarga pilihan yg terbaik apa?
raise vs sonet vs rocky vs xpander?",5 months ago,2
Aing yeuh84,UCzTZR6nUvLNFbNYuGPDQ7vw,Ugx_v1bmozhziZh0CVt4AaABAg,0.0,https://yt3.ggpht.com/ytc/AKedOLQt2bZFlLKXs94aIAh9f1LAvrVRky21cR8CLg=s176-c-k-c0x00ffffff-no-rj,00:54 pada link diatas tdk kelihatan. Mohon diperbaiki cardsnya mimin OD. Keren reviewnya euy. Jadi ga sabar punya. Apalagi mesin yg 1200 cc. Hehe,5 months ago (edited),0
Edy Cullens,UCaxWcaJk-CsH90u4iZv5WIw,UgxwwAQ2HdgZd5Sm2pd4AaABAg,0.0,https://yt3.ggpht.com/ytc/AKedOLQn5YCZj2u-QpxECe58zJT0N1YMxl8s50PT9k_9rQ=s176-c-k-c0x00ffffff-no-rj,"Mentang2 ada sponsor nya
Pas ngomong ""ada cup holder di ac"" 
Bahagia bgt keliatan nya",5 months ago,0
Armando Bonisius Notty,UCgz-3Gie3IAJ0EAEYIswhbw,UgyZepkJGCJmnIhP2nF4AaABAg,0.0,https://yt3.ggpht.com/ytc/AKedOLSDFTWAte7gL7XMqiORalOXi0Wf5DY-IWV9nC7qXg=s176-c-k-c0x00ffffff-no-rj,Road Party season 4 : raize & rocky,5 months ago,0
Adnan Yudho,UCXDCwgsTRl_PpQuCt8bXGow,UgySLMton19MnDUkuAB4AaABAg,0.0,https://yt3.ggpht.com/ytc/AKedOLTMSN9ms0oW9mc2UqZHtKTE6_PVXM9kSsVu=s176-c-k-c0x00ffffff-no-rj,ditunggu video komparasi dengan Kia Sonet dll,5 months ago,0
indraachen,UCVcvZkxymxllkHzAVLU6RnQ,UgzaxdcCaolas1PGzad4AaABAg,0.0,https://yt3.ggpht.com/ytc/AKedOLTSGDdviy6q1xHcmVTYyfrCEyOJWbOh13vliO541g=s176-c-k-c0x00ffffff-no-rj,product placementnya smooth sekali... mantap,5 months ago,2
christofer sinarya,UCJ7hjwrTzdIOON-1sp0NXdA,UgxAURC0jUWBM0VpLtd4AaABAg,0.0,https://yt3.ggpht.com/ytc/AKedOLSFsDT3sOKQYoXVLdDwsIM7L5aVp5FeG6izUVje=s176-c-k-c0x00ffffff-no-rj,Kayanya keren kalo ada varian convertible (?),5 months ago,0
Ferry Ibrahim,UC58IWCK6HzEBwQgURT9hWIQ,UgzKOPiNLbA3sjHnaOV4AaABAg,0.0,https://yt3.ggpht.com/ytc/AKedOLTKANbaMz2WivM74IMN21listKNT9qL1VEU0S22XQ=s176-c-k-c0x00ffffff-no-rj,"Bisa menjadi salah satu mobil impian.. 👍
Semoga semua dberi rezeki untuk memiliki mobil ini..
Sehat selalu om fitra.. 👍",5 months ago,20
Yogi Afridhitama,UCNELeGI4o43spCVU3plbHpA,UgwZWrIb7LVUA-Rp_Th4AaABAg,0.0,https://yt3.ggpht.com/ytc/AKedOLQh1ndOHF3K82-RPjSB_2tvFBP5RUI-kBvuydc3mw=s176-c-k-c0x00ffffff-no-rj,Bahan plafonnya masih avanza sekali. Kain murah gtu,5 months ago,0
Imam Setyawan,UCmLPVZaE6xJlxAGyJjbt87A,UgwQfS9uN-rAzKSHrG54AaABAg,0.0,https://yt3.ggpht.com/ytc/AKedOLR6PK6sIBCG4VINh-ovnNGKXFEVYnzJL9DO_3qi=s176-c-k-c0x00ffffff-no-rj,Jelek disennya + bantet,5 months ago,0
Reza Ariditya,UCb8G79YI3mrrdbkMqAlkaFQ,Ugw-3LGqbFX6_KlGVJJ4AaABAg,0.0,https://yt3.ggpht.com/ytc/AKedOLQFxgDc_F1IidI0j79FnJQALuc0Kk4D3rFd-FAQQw=s176-c-k-c0x00ffffff-no-rj,"Coba tes isi 5penumpang, bbm full tank, truss tes di tanjakan bukit pelangi. 

Dr dulu di project mbl kembar toyota - daihatsu, HU toyota pasti kalah bagus dr daihatsu. Ban pun dikasi yg eco2an, Heran msh aja pelit...😂😂😂
.
Stiap habis review bikin penilaian 1 - 10 dr mobilnya, tes di sirkuit jg dong Mas bejekk deh tuh mbl, kan mbl sendiri ini jd lbh bebas dong mau ngetes / ngereviewnya mau pake cara gimana juga...😁😁😁
.
Salam sehat selalu...😉",5 months ago (edited),0
Arifin Azhari,UCXY3PQZGV6KJgeEapjT1Bsg,UgxObr6uqPUsrsTX45N4AaABAg,0.0,https://yt3.ggpht.com/ytc/AKedOLQN8zj1g-PSt68Tu5QWyHq6TW8rWIk2h3kDCg=s176-c-k-c0x00ffffff-no-rj,Mas Fitra Eri! kalau didaerah yang akan laku adalah yang berkapasitas 1200 CC empat cylinder. Karena didaerah mobil dengan kapasitas tiga cylinder paling tidak disukai. Ini semacam traumatic bagi orang didaerah tentang mobil tiga cylinder. Walau diiming imingi turbo sekalipun tapi yang 1000 CC tiga cylinder tetap tidak akan pernah diminati (laku) didaerah. Kenapa bukan yang 1200CC saja yang dipasang turbo sebagai varian produksi.,5 months ago,1
Reza Octavion,UCggv5_okVBk6R3Uyw4AexwA,UgxXikhV9VIqfDj5-p54AaABAg,0.0,https://yt3.ggpht.com/ytc/AKedOLRGy6uFyRWY2mgyXq6Bj6dZ0SUnuaHf8dGQ4A=s176-c-k-c0x00ffffff-no-rj,"rem nya kurang pakem menurut sy waktu sy test drive, interior pilar kurang rapi goyang2, tombol matic goyang2 kurang solid sptnya 😅",5 months ago,0
Lombok ASA,UCGyeB-riJDxQl64YkxIndFg,Ugz2nXcREX28x_K-In54AaABAg,0.0,https://yt3.ggpht.com/ytc/AKedOLSsqL-fXIycAyiPZ0pN3XWcFY7GPDXfrsYm21Ob=s176-c-k-c0x00ffffff-no-rj,Yang paling saya bsuka tinggi saya 177 cm.,5 months ago,0
Indonesia Raya,UC3E7YZhm4KS5eIRxlPkkhgw,UgxEVU7ecSIgWw13OZx4AaABAg,0.0,https://yt3.ggpht.com/ytc/AKedOLQRmKcfDYmLcTloFxudvALaq-SHTBnrEDYN78xN=s176-c-k-c0x00ffffff-no-rj,OMB ambil unit Rocky ya Oom?,5 months ago,0
Ivan Ardianto,UCNSWAR-eaP6CYatcSAs0j3g,Ugzjw9CsYAb6ac3u8XN4AaABAg,0.0,https://yt3.ggpht.com/ytc/AKedOLTVMYknSSD538mjeNywule3jYuTepLTkQtg_y8zXw=s176-c-k-c0x00ffffff-no-rj,Warnanya mirip sama punya ridwan hanif ya om,5 months ago,0
Danny WePe,UC-GDYnYoHgdaK4TZCFp7Lcw,UgxXS6xKns3s163YyR54AaABAg,0.0,https://yt3.ggpht.com/ytc/AKedOLQe_9X-ALByeKvmZpuEuPhZRjM_8jM_XfWcPTSRzw=s176-c-k-c0x00ffffff-no-rj,Klakson angkot 🤣,5 months ago,0
Khansa Paradis,UCQFd5KL8soeV9vsazupQ6Ew,UgwsYNtfU0ECK68WH-h4AaABAg.9O-1UQjoRfe9QKmrQiPqf2,0.0,https://yt3.ggpht.com/ytc/AKedOLSGg0sSGMQMHgPLDJKNnfH9nIG28ZkG0AJmEw=s176-c-k-c0x00ffffff-no-rj,Ini iklan Toyota secara halus juga bro😀,3 months ago (edited),1
Sky Line,UCTgtj91MZ6paxm7we5xNNpw,UgwsYNtfU0ECK68WH-h4AaABAg.9O-1UQjoRfe9RAL3WSbgAN,0.0,https://yt3.ggpht.com/ytc/AKedOLR1YQXMtVGdmZoGdwh-J3MubaopjZhVmjeF8fEfxg=s176-c-k-c0x00ffffff-no-rj,"Toyota raize : Terimakasih Daihatsu rocky, karena kecanggihan teknologi mu...",3 months ago,1
Andi Handoko,UC1wz7ycZPAijLDVMXeBuK0g,Ugz-v6H0gCIVu6-EilF4AaABAg.9O-1-OGxJhe9O299aCIdpR,0.0,https://yt3.ggpht.com/ytc/AKedOLQV_YbzeBfb5oZVtE9RwVtGhBV-qb0aJSJdlVQDFMU=s176-c-k-c0x00ffffff-no-rj,"klo pilihannya cm itu, ya jelas xpanderlah.",5 months ago,1
Daniel Setyawan,UCs3KTYB6xYJvD136Zq5wOGg,Ugz-v6H0gCIVu6-EilF4AaABAg.9O-1-OGxJhe9O3AxQBqjxw,0.0,https://yt3.ggpht.com/ytc/AKedOLS0PqC50BXW4YI9JhPZaGt1zpEYE5OPb6PWghH_VA=s176-c-k-c0x00ffffff-no-rj,"Mobil keluarga ya jelas MPV om. Dari semua yg om sebut di atas, cuma xpander yg masuk kategori MPV, sisanya masuk kategori SUV/compact SUV/sub compact SUV.",5 months ago,1
Sam Tan,UCVEEb2wongKaFzPDI5VpF7A,Ugz-v6H0gCIVu6-EilF4AaABAg.9O-1-OGxJhe9O4qy7kVWmt,0.0,https://yt3.ggpht.com/ytc/AKedOLQ4LcdpCG_l0FlVrxofBHWQrRioI-Y2s2Uw4GRx=s176-c-k-c0x00ffffff-no-rj, @Daniel Setyawan  kl untuk merk lain buat katagori mobil keluarga dibawah 300jt apa pilihannya?,5 months ago,0
Daniel Setyawan,UCs3KTYB6xYJvD136Zq5wOGg,Ugz-v6H0gCIVu6-EilF4AaABAg.9O-1-OGxJhe9O71QaiEj6_,0.0,https://yt3.ggpht.com/ytc/AKedOLS0PqC50BXW4YI9JhPZaGt1zpEYE5OPb6PWghH_VA=s176-c-k-c0x00ffffff-no-rj," @Sam Tan  ertiga, avanza, xenia, cortez, mobilio, dll",5 months ago,0
Sam Tan,UCVEEb2wongKaFzPDI5VpF7A,Ugz-v6H0gCIVu6-EilF4AaABAg.9O-1-OGxJhe9O71yZrrg8H,0.0,https://yt3.ggpht.com/ytc/AKedOLQ4LcdpCG_l0FlVrxofBHWQrRioI-Y2s2Uw4GRx=s176-c-k-c0x00ffffff-no-rj, @Daniel Setyawan  yg terbaik mobil dibawah 300jt yg mana?,5 months ago,0
eXeL99,UCIb-mZYpNK_061ErdcE7WdQ,Ugz-v6H0gCIVu6-EilF4AaABAg.9O-1-OGxJhe9O7I9h5E4cc,0.0,https://yt3.ggpht.com/ytc/AKedOLSwf179c4iBl8COUCqwkKznqu-5UUmSHCM6EE0rrw=s176-c-k-c0x00ffffff-no-rj," @Sam Tan  Mobil keluarga, asumsinya 7 seater.. Terbaik dalam hal apa neh? ga ada yg sempurna di tiap mobil.",5 months ago,0
Sam Tan,UCVEEb2wongKaFzPDI5VpF7A,Ugz-v6H0gCIVu6-EilF4AaABAg.9O-1-OGxJhe9O7JP5VfsaC,0.0,https://yt3.ggpht.com/ytc/AKedOLQ4LcdpCG_l0FlVrxofBHWQrRioI-Y2s2Uw4GRx=s176-c-k-c0x00ffffff-no-rj," @eXeL99  terbaik dalam kenyamanan, tahan banting dan ga rewel",5 months ago,0
Daniel Setyawan,UCs3KTYB6xYJvD136Zq5wOGg,Ugz-v6H0gCIVu6-EilF4AaABAg.9O-1-OGxJhe9O7cljMcYyo,0.0,https://yt3.ggpht.com/ytc/AKedOLS0PqC50BXW4YI9JhPZaGt1zpEYE5OPb6PWghH_VA=s176-c-k-c0x00ffffff-no-rj," @Sam Tan  kalau om gak fanatik brand, go for cortez om. Nyaman banget itu mobil. Cocok buat keluarga. Cuma ya brandnya wuling.",5 months ago,1
Sam Tan,UCVEEb2wongKaFzPDI5VpF7A,Ugz-v6H0gCIVu6-EilF4AaABAg.9O-1-OGxJhe9O7dRXovOGB,0.0,https://yt3.ggpht.com/ytc/AKedOLQ4LcdpCG_l0FlVrxofBHWQrRioI-Y2s2Uw4GRx=s176-c-k-c0x00ffffff-no-rj, @Daniel Setyawan  brand sih gak masalah tapi bentuk mobilnya itu loh yg out of date :(,5 months ago,1
Daniel Setyawan,UCs3KTYB6xYJvD136Zq5wOGg,Ugz-v6H0gCIVu6-EilF4AaABAg.9O-1-OGxJhe9O7eTstPKIv,0.0,https://yt3.ggpht.com/ytc/AKedOLS0PqC50BXW4YI9JhPZaGt1zpEYE5OPb6PWghH_VA=s176-c-k-c0x00ffffff-no-rj," @Sam Tan  nah, bener kata om di atas om. Gak ada yg sempurna. Cortez nyaman tapi ya di sisi lain ada yg kurangnya juga.",5 months ago,0
eXeL99,UCIb-mZYpNK_061ErdcE7WdQ,Ugz-v6H0gCIVu6-EilF4AaABAg.9O-1-OGxJhe9O7rGhFA8nI,0.0,https://yt3.ggpht.com/ytc/AKedOLSwf179c4iBl8COUCqwkKznqu-5UUmSHCM6EE0rrw=s176-c-k-c0x00ffffff-no-rj," @Sam Tan  IMHO, klo yg tahan banting ga gampang rewel ya biasanya Avanza/Xenia. Klo mo nyaman perjalanan ya Ertiga, Xpander, Livina, Cortez. Mo fun to drive ya Mobilio. Ga ada yg mendominasi 100%.",5 months ago,0
