author,channel,cid,heart,photo,text,time,votes
jrmd kaosmotogp,UCjyl5twrrBtgwHGyFgWIZsQ,UgxwQfQQtl3o-fbWbbx4AaABAg,0.0,https://yt3.ggpht.com/ytc/AKedOLTIbJ-cs3AR76aXBClhWHH_JF-QkNebTmZ1ZCMEcYw=s176-c-k-c0x00ffffff-no-rj,Enakan apanja kymya,5 months ago,0
Sugeng Raharjo,UCKBwOHQ3qWGneWho4Hh-HRQ,Ugz9V4eVMBx8RWDx8294AaABAg,0.0,https://yt3.ggpht.com/ytc/AKedOLT_vMUJKA8fcamkwvZ4ymvxb0dO6RN57HzfjA=s176-c-k-c0x00ffffff-no-rj,"Om fitra lagi, yang di nanti nanti👍👍👍",5 months ago,3
Muchammad Insani,UC73r27OANf_UKA5z4TWA2oA,Ugziv8ms1LuTYqUkcdl4AaABAg,0.0,https://yt3.ggpht.com/ytc/AKedOLQiwkq2G_MnR-y8PLUUVJSkp6Jbcjie0_H4b36o=s176-c-k-c0x00ffffff-no-rj,3 silinder apa enak nya ya?,5 months ago,1
Irfan Ardiansyah,UCKZnV9zEwxDcB9vHnMi1fHw,UgxCNrnZDgT8dmCJM394AaABAg,0.0,https://yt3.ggpht.com/ytc/AKedOLSzNxkQiLlZj0LiDBW_ERONp7__X7sn78Np1IKktQ=s176-c-k-c0x00ffffff-no-rj,Ko lebih bagus mas ridwan ya 😂😂😂,5 months ago,7
manusia biasa,UCDtdCmAQfTlCboUbTwBhs9Q,UgxYaxS_JeWy63e1aep4AaABAg,0.0,https://yt3.ggpht.com/Fexxzam5J17zJZ0ylcc8y2AS9zQ2Wd2qbIq2JswFb9bHCnOrVwjuHuxRH-jheo_aRvpxVMD6gw=s176-c-k-c0x00ffffff-no-rj,"sejauh ini masih tertarik dgn kia sonet premier
dikomparasi dong om keduanya 🙂",5 months ago,16
manusia gendut,UCpeFUTi0k618akrbxdVZbRQ,UgznjRTN09mQp9CC_aJ4AaABAg,0.0,https://yt3.ggpht.com/ytc/AKedOLTdingsiZl9O_bAZOyli_16ghz-qiy9DXncFA=s176-c-k-c0x00ffffff-no-rj,"Utk klakson itu tidak terlalu NiSTA kok.
itu cuman sama persis dengan mitsubishi T120SS.",5 months ago,0
Raditya Dharma Putra,UCR-4zqypVG6tMjru9VOeJkQ,UgyAZA3oejyjiEBhtE14AaABAg,0.0,https://yt3.ggpht.com/ytc/AKedOLRkpBPjecfc2YB_X9j3tmWIJhoqCJmbzPTVD_o=s176-c-k-c0x00ffffff-no-rj,11:20 om modifikasi pakai punya rocky saja,5 months ago,0
Hendra Li,UCrm7PnVHBsbQ-YfJc61EbVg,Ugxi6eyWl8WkwYnl_lJ4AaABAg.9Nvru96iNfT9Nw8orSoRb-,0.0,https://yt3.ggpht.com/ytc/AKedOLQF8Ne7_V545gAcNXBR1MJsy3-PCQLD1sl1KbEs=s176-c-k-c0x00ffffff-no-rj,Plat sementara itu....,5 months ago,0
uyeahuyeah,UCIsrnwTJj9W9trubNp0XmBw,Ugziv8ms1LuTYqUkcdl4AaABAg.9NvpnuXOqtk9O6EBtzVzFI,0.0,https://yt3.ggpht.com/ytc/AKedOLTJLS3rfw9gj2qFW4KkS_ZrrMVULySPVpQUfg=s176-c-k-c0x00ffffff-no-rj,"Menang iritnya, klo ditmbh turbo lumayan ada tenaganya drpd tanpa turbo",5 months ago,0
Adit Adit,UCZr0630vMD7ttGso2GBCnSg,UgxYaxS_JeWy63e1aep4AaABAg.9NvpIwLi47b9NxlJUubEKy,0.0,https://yt3.ggpht.com/ytc/AKedOLSNv5RJFJR8nihy6q1BWYl3MRDtQCkXH688iw=s176-c-k-c0x00ffffff-no-rj,Fun to Drive itu masalah cita rasa,5 months ago,1
Lucky889 S,UCRbTsfernyKSpPbVaMR9E_w,UgxYaxS_JeWy63e1aep4AaABAg.9NvpIwLi47b9NxmFDBojYe,0.0,https://yt3.ggpht.com/ytc/AKedOLSKGVqXXC5v0aLgAITVDUCMWwwWGh_fZOFi3g=s176-c-k-c0x00ffffff-no-rj,Premier beda harga. cocoknya sih sama tipe smart sampai dynamic yg minus sunroof. Sama magnite yg turbo jg,5 months ago,2
Biyu,UCvWlzVde6j4DEYuF9VWd0gw,UgxYaxS_JeWy63e1aep4AaABAg.9NvpIwLi47b9O2WRsbiWdJ,0.0,https://yt3.ggpht.com/jyNpGQ_RADAmUCsMvzgibw1yc83f3ErGLosW6-BWA0n27MmXirAJrEGFjiAdtqJwEAsovZECjmY=s176-c-k-c0x00ffffff-no-rj,"Rasa berkendara dewasa dan jok pendingin yang bisa dinikmati setiap hari, kalau fitur gimmick tss cuma bisa dirasakan pas jalanan lowong",5 months ago,0
Andri Juliansyah,UC2bZ6gbFvl7uKf9GXm9QhOw,UgxYaxS_JeWy63e1aep4AaABAg.9NvpIwLi47b9PUwUG0HzHz,0.0,https://yt3.ggpht.com/ytc/AKedOLTW54Affyecyy2-dkpEkwVNwzkq5wrWi-KcXA=s176-c-k-c0x00ffffff-no-rj, @Biyu  emang dapat pendingin jok di sonet yg seharga ini?,4 months ago,0
Syariah Gurl,UCNppha18FMf90j8wpXh7CBg,UgxQ_lRF0RIvGpi_RRN4AaABAg,0.0,https://yt3.ggpht.com/ytc/AKedOLQoZJHfFAiR7528zaiGbfZloRkenr6DoYIiGg=s176-c-k-c0x00ffffff-no-rj,Entah knapa moncong mobil nya aneeeh🤣 kyak kk nya suzuki ignis,5 months ago (edited),2
Tony Prihartanto,UCmQgbwo2FF_iqOpunWnBDrg,UgxTx3sIcyZOohBRXLh4AaABAg,0.0,https://yt3.ggpht.com/ytc/AKedOLQUtbuhM9P0Jnae6Y5UWm-lLUpC-jg1wreyR3-a=s176-c-k-c0x00ffffff-no-rj,"""Link di atas"". Saya lihat langit2",5 months ago,0
Kelvin Arisaputra,UCtfg9etoGdD7aZAwq8KnA5g,UgyebpHg8ax2YvsHg-V4AaABAg,0.0,https://yt3.ggpht.com/ytc/AKedOLS9nxaaPxsCqLMEIJ-C_sG709ZRrSrtJqRgLtAd=s176-c-k-c0x00ffffff-no-rj,35:49 hah... silahkan apa ':D,5 months ago,3
Andi Setiawan,UCcjUL4UdWiZXskZ9szCiNJA,UgzW1PrVz-Fx0aXAeZp4AaABAg,0.0,https://yt3.ggpht.com/ytc/AKedOLTZ9oy89MawwJxiuQ2SZAyOlIGZ2ADlNEWyUK4SZA=s176-c-k-c0x00ffffff-no-rj,mending kia sonet lah...,5 months ago,1
Ananto HR,UCfAcmLp7ca1SBEmD3DRveQw,Ugw2AMMf7BHB56R4YFd4AaABAg,0.0,https://yt3.ggpht.com/f3zqOuriAwp_ze5JKlBDw8-E2UM9XTtbXsJZsOgV8j3iw3KumlTUlN__hyUuXRldHZpbueMc=s176-c-k-c0x00ffffff-no-rj,"33:01 sedikit mengganggu hehe...
Tampangnya memang kereeennn, dengan kap mesin tegak sedikit memanjang dan grill tegas lurus.",5 months ago,1
Asep Suhendar,UCmhld-WH3iJ32X9svrSpSoQ,UgxQ6zgssqYKIgunlcN4AaABAg,0.0,https://yt3.ggpht.com/ytc/AKedOLT0--9lWtWuz7nCVc-Ze9vcO0dGpz8BUuaMzwFWfg=s176-c-k-c0x00ffffff-no-rj,Review sikembarnya Daihatsu Rocky 😎😎😎,5 months ago,0
Muhammad Hanif - Secondary,UC7qLTTkZ_d3TtTPeuSzlwqA,UgycNupQXKrZBtQYR_F4AaABAg,0.0,https://yt3.ggpht.com/ytc/AKedOLQ1seO9tQtbB3YH8Ge6hoad7vFUC4KkA2_q8DjaDw=s176-c-k-c0x00ffffff-no-rj,Thanks tim OtoDriver untuk reviewnya. Masukan untuk kedepannya bisa dibuatkan timestamp di video agar bisa langsung melihat poin yang diinginkan.,5 months ago,23
Meetmy J,UCaS0IcVz4UVhtkZBUiaNSXg,UgxZXMxIDs0MpFotFb14AaABAg,0.0,https://yt3.ggpht.com/ytc/AKedOLQ0cR6lDRxx2WscHUDRPxqgpxWx5LECav_sNtNieg=s176-c-k-c0x00ffffff-no-rj,"Mobil kecil kayanya sih ga gitu perlu fitur radar gitu,lebih guna di mobil2 gede fortuner innova malah ga ada tss",5 months ago,0
Dark Matter,UCcrnY8qCTsH4eRUFu8ZnsIQ,Ugwv6_Po4pVF0WGLlJZ4AaABAg,0.0,https://yt3.ggpht.com/ytc/AKedOLTbCCT00-rGRj3UjLdLhAWlGdgmWSoePbGghfDO6TKjnkbSmQk38MBdBwGqEmh7=s176-c-k-c0x00ffffff-no-rj,"Kalau Astra keluarin yg versi 4WD, walau 100jt lebih mahal, inden Jimny kisaran separuh bisa pindah ke mobil ini. 👍",5 months ago (edited),0
Freddy Gunawan,UCBa6UCJdMcqER7lW0FvAUyg,UgwOiUsT_OqANKBgqoJ4AaABAg,0.0,https://yt3.ggpht.com/ytc/AKedOLSeley0IlkmsmHbpodK7SP86ri43VhO2NKFyr63cg=s176-c-k-c0x00ffffff-no-rj,Tombol kosong = sunatan😂,5 months ago,0
RAHMAT RAP,UCNMeah1Emu3xk8kgOdp1pgA,Ugw8r7Yttn9K6Ajdel14AaABAg,0.0,https://yt3.ggpht.com/ytc/AKedOLSFw4B17_s91ofmyM42gUvUBr6Q5Rm2HGRUnGaKjQ=s176-c-k-c0x00ffffff-no-rj,"keren banget, semoga bisa memiliki",5 months ago,4
Dharma Aji,UCdZw1Y4SpCzYe6zHyhhaK_g,Ugx4S_EXgl4-m-8m5SJ4AaABAg,0.0,https://yt3.ggpht.com/ytc/AKedOLS29iqtGx1Mg3sCOMSGGWN4Vm5r6L56eH4vBRhcQpM=s176-c-k-c0x00ffffff-no-rj,Allahuma soli'alaa muhammad wa alaa ali muhammad,5 months ago,5
Jum Ardi,UCuojbffIqo6I4jbVR5KTHzw,UgwASjP2sDXPFU8Sef54AaABAg,0.0,https://yt3.ggpht.com/ytc/AKedOLRXl_3HrILWsTI9bx5aGFSLpMBd7ZedpIiUjA=s176-c-k-c0x00ffffff-no-rj,"Saya suka sekali Om Fitra minum pakai tangan kanan seperti Mas Ridwan Hanif

Istimewa",5 months ago,16
wahyu andrian,UCznHR7YL669rrV8YQBu7cow,Ugydc6Ck3lbwnWWotLN4AaABAg,0.0,https://yt3.ggpht.com/ytc/AKedOLRtLQGf4iBx_J0A49L1ivEM4sDQFBRCVPBxw_rNbw=s176-c-k-c0x00ffffff-no-rj,Mirip mirip Terios lama ya,5 months ago,0
made mario,UC6dhQWIfb8IuG7qrh7SfGvg,Ugxjncx3aII87xISa6F4AaABAg,0.0,https://yt3.ggpht.com/ytc/AKedOLQUg75xnQ7W_HA4bLuNi81V2xyQ7K-6z0l5Vt1F2A=s176-c-k-c0x00ffffff-no-rj,minusnya head unitnya belum biasanapple car play dan android auto,5 months ago,0
Kusuma Wijaya,UCIgGpwI5fSVL_9urulkOuHg,UgzSQ9-DQhogxx0jplB4AaABAg,0.0,https://yt3.ggpht.com/C_z_D5wPWzML-Bgi5XTJi3LDyeoLPROZ7lH6AAUfNuUeDJI1sLIpMwI5eEjPJr1-lqFox9s4Mw=s176-c-k-c0x00ffffff-no-rj,abis ini mampir ke swalayan buat beli kapal api signature,5 months ago,0
Khaerul Ihsan,UCODbc-aeyQaryzQaLjcbl-A,Ugxu4gQ-VmNjdAl8CZl4AaABAg,0.0,https://yt3.ggpht.com/ytc/AKedOLQWAkh3i7l2QrD4Vhxwc4D_aZGwlAt1Ilg5MMXd8hY=s176-c-k-c0x00ffffff-no-rj,"Bumper depannya gantengan Rocky,",5 months ago,0
dedi chandra,UCrC3Y6HY2DSQloigGMNLQmg,UgxlcnBxr8V4omgfLIx4AaABAg,0.0,https://yt3.ggpht.com/ytc/AKedOLToTF41rpmYj8gZXh7k3_Dg0x3GzKRUUcS3OZRY=s176-c-k-c0x00ffffff-no-rj,Ignis hati2 nich...,5 months ago,0
kanjo._,UCo8X4s9uSgGr0HGNOO4a6NA,UgxaSUPCZPVjjLy3mdV4AaABAg,0.0,https://yt3.ggpht.com/BoImM-Y7raSyW-J-toJdM2QArVKAySF6vGygQnqyRoccNOHMlGSwWxigdrV3ksZWHugGJQuz-Q=s176-c-k-c0x00ffffff-no-rj,om fitra gak suka mesin 3 silinder ya? padahal merdu suaranya seperti mesin 6 silinder tapi versi paket hemat 😂,5 months ago,1
jack asad,UCio13M5hQb0w3hG9660Axlw,UgxZp24kWkkv-pumulF4AaABAg,0.0,https://yt3.ggpht.com/ytc/AKedOLQfRBFdMozJr-CHXUbCrAKIbQq-kakxjh7YjPJDow=s176-c-k-c0x00ffffff-no-rj,mending beli wuling almaz rs aja om xixixi,5 months ago,0
Andi F,UCDSt5R2wH2uR_6o9WhgIkSw,UgyebpHg8ax2YvsHg-V4AaABAg.9NvoqcNzYX-9NwKVee3Vtm,0.0,https://yt3.ggpht.com/ytc/AKedOLQN3jgFnopDTbc6Po2X0wmA5ZMaLeaKqa-s=s176-c-k-c0x00ffffff-no-rj,mungkin ada orang mau lewat nunggu take closing selesai,5 months ago,0
Hendra Li,UCrm7PnVHBsbQ-YfJc61EbVg,Ugw2AMMf7BHB56R4YFd4AaABAg.9NvoUTP30A49Nw9AWBU2Sb,0.0,https://yt3.ggpht.com/ytc/AKedOLQF8Ne7_V545gAcNXBR1MJsy3-PCQLD1sl1KbEs=s176-c-k-c0x00ffffff-no-rj,Klakson angkot atau motor?,5 months ago,0
Ananto HR,UCfAcmLp7ca1SBEmD3DRveQw,Ugw2AMMf7BHB56R4YFd4AaABAg.9NvoUTP30A49NxHE0JxRuO,0.0,https://yt3.ggpht.com/f3zqOuriAwp_ze5JKlBDw8-E2UM9XTtbXsJZsOgV8j3iw3KumlTUlN__hyUuXRldHZpbueMc=s176-c-k-c0x00ffffff-no-rj," @Hendra Li  shootingnya, bukan klaksonnya... pencahayaan sinar matahari sampe masuk ke kabin mobil.",5 months ago,0
Reff Ratama,UCPGrVVnpRgSX5MSFbJw3VIQ,UgxZXMxIDs0MpFotFb14AaABAg.9NvnpScDATF9Nw088r94SB,0.0,https://yt3.ggpht.com/ytc/AKedOLRnw4HKo2YtjNZy0yXU1OfrvBpUjWIDeOhhjuKU4A=s176-c-k-c0x00ffffff-no-rj,"Mobil gede brarti orngnya lebih pro mngemudi, gk perlu fitur ginia 😂",5 months ago,0
Asptta_ar2,UCwwH8hINW5swiGTClR8mr_Q,Ugw8r7Yttn9K6Ajdel14AaABAg.9Nvm3bvq3tM9NxoHrpSmb0,0.0,https://yt3.ggpht.com/ytc/AKedOLTYcmEIGeAmNFlWdApvEo7_4OjceF3qMG3OPjwRfA=s176-c-k-c0x00ffffff-no-rj,Aamiin.,5 months ago,0
Sime Millenia,UCQ_01dFR1pQVn5Wep0Xsxsg,Ugw8r7Yttn9K6Ajdel14AaABAg.9Nvm3bvq3tM9VCeBlYc3Qm,0.0,https://yt3.ggpht.com/ytc/AKedOLQS4snGUd4XEAW7eDAz-oA-Hy6VqSYxRw-FgP7F=s176-c-k-c0x00ffffff-no-rj,Amin,3 hours ago,0
Semut Ireng,UCvZ7OsJz60Gv69WlFTD_GwQ,UgxUqwJrdtyDLot9j1p4AaABAg,0.0,https://yt3.ggpht.com/ytc/AKedOLRmx6kiyP4rMoL6drkAveBvJF_5G8TDoiMr=s176-c-k-c0x00ffffff-no-rj,Mobil sendiri gk mungkinKan dijelek - jelkin 😅😅😅😅,5 months ago,5
ɪʙɴᴜ ᴀʙɪ ᴍᴜsᴛᴀǫɪᴍ,UCYu5zYfreslqLNtcgx6U1Lg,UgxYKeQpFCP5ee7lYlh4AaABAg,0.0,https://yt3.ggpht.com/ytc/AKedOLRUVl7E0QVvVgb-crtR4_LSIN7rsA0xAn7Yuh1BJQ=s176-c-k-c0x00ffffff-no-rj,Woowwww 😲😱,5 months ago,0
Andre Junior,UCjeXzMI3CoVAOuiSyj11pSA,UgxmUYLob3q4BQqFF8h4AaABAg,0.0,https://yt3.ggpht.com/ytc/AKedOLToEBLhEwPiIk8N7IPj5MEiyGPp_CMqyEG9MCe-yw=s176-c-k-c0x00ffffff-no-rj,21:28 engineer Toyota atau Daihatsu ya?,5 months ago,5
Fauzi Rachmaninov,UCuydwpdtiZSVhWFqJA5Jzlg,UgxvU_lysqLCD1LjjyJ4AaABAg,0.0,https://yt3.ggpht.com/ytc/AKedOLTOnEuwFxbp68fY5bns9p_1meBQ4bSIGDspAs5I=s176-c-k-c0x00ffffff-no-rj,Kirain sekelas dengan HR-V,5 months ago,0
GALIH PRAMUKTI,UCCFxgDyNmd6dlkZztGVo_yw,UgwRPNnevqjkUnaxT8l4AaABAg,0.0,https://yt3.ggpht.com/SCmeF7t3ihwXs6VmfH_Pc97mcT1DnCv0E99Ghd5xPWOivjJ2H1iDEXRK7apzL_i-uUi63oRNrg=s176-c-k-c0x00ffffff-no-rj,Om.. Jaminan servicenya yg bener 4th / 50.000km* 🙏,5 months ago,2
Ayup Jaya,UCjWRSXH1iS2opTFRARTEUaA,UgwgGZ6XAom-pOuRTSh4AaABAg,0.0,https://yt3.ggpht.com/ytc/AKedOLS_qboROG5s0yIi0_qhkb39QnAx7yBT-bCMCFZJ=s176-c-k-c0x00ffffff-no-rj,Rasa DNGA😉,5 months ago,0
teddy padma kwardiano,UCt5hP2owoAhbR2Ml2fFZyug,Ugzkl7i-RVbuQ7npzdt4AaABAg,0.0,https://yt3.ggpht.com/ytc/AKedOLSGXcAhk04fLs6Mh_58bMaTsRoaPv2e8ddZcw=s176-c-k-c0x00ffffff-no-rj,Sayangnya 3 silinder....kuat di tarikan bawah...kurang ganas di tarikan atas meski turbo...,5 months ago,0
abdul rouf,UCiZd51ror9dMskk71CKBLqg,UgzpyBB5gQUXOQGTjJV4AaABAg,0.0,https://yt3.ggpht.com/ytc/AKedOLRVIzFq_sDQsB7ixAiVcD9Y0JA0AreYgD1FonwiGQ=s176-c-k-c0x00ffffff-no-rj,Yg ditunggu muncul juga,5 months ago,0
Ruli Arli,UCQLJJctleucK381OegUQZsw,UgzDMczUg8VxtvNXYWF4AaABAg,0.0,https://yt3.ggpht.com/ytc/AKedOLTBQPh9vougsQfBX1vuYq2WebFDMSDFKhRSra1jKA=s176-c-k-c0x00ffffff-no-rj,Fix beli KIA Sonet,5 months ago,0
Reflis Rey,UC8721HCUD99wdlpjbpMFAyg,UgzX2g5I7Zpe5DiADUV4AaABAg,0.0,https://yt3.ggpht.com/ytc/AKedOLR03OzzXSK12Wpk52D_wOqxqKBiMLDlG6gI0A=s176-c-k-c0x00ffffff-no-rj,"Desaigner,,,,toyota koq ga kreatif yaaa.kyk ga ada inspirasi & inovasi....",5 months ago,2
Reflis Rey,UC8721HCUD99wdlpjbpMFAyg,UgzQvVZqvjAb88uJ6Dl4AaABAg,0.0,https://yt3.ggpht.com/ytc/AKedOLR03OzzXSK12Wpk52D_wOqxqKBiMLDlG6gI0A=s176-c-k-c0x00ffffff-no-rj,"Disainnya koq kayak mobil murahan,bodykitnya malah bikin jeleeek....maaf🙏🏻🙏🏻🙏🏻",5 months ago,2
DG Steve,UCA1KGvPEBt5wYX05pUkPYYQ,UgzHenyBM27SJbX59nh4AaABAg,0.0,https://yt3.ggpht.com/ytc/AKedOLQZkSyYqlLC6nRJFA2kNPOl3uaoCueubAs8KQ=s176-c-k-c0x00ffffff-no-rj,"Om cobain dong sesekali review mobil ditanjakan area pelabuhan ratu- sawarna, biar ketauan kuat enggaknya nanjak",5 months ago,0
Acen Ganteng,UCtZ6wUGTYV4egmcKFmwtyfg,UgwQaFcB1w50y9AwBet4AaABAg,0.0,https://yt3.ggpht.com/ytc/AKedOLQNKj7WNIAGQ26lMVCsGEiIVN9wo9wgNnFElg=s176-c-k-c0x00ffffff-no-rj,Yg rumah nya langganan banjir disarankan jangan beli,5 months ago,0
Yatno Supriatno,UCT0aUfYkf5g6SIgeMIiQltQ,UgytkTrrdlQzO14lOlx4AaABAg,0.0,https://yt3.ggpht.com/ytc/AKedOLSnldEkOQu8sokm5SAYh2DVZEuw6jCEr7Qxzzx8=s176-c-k-c0x00ffffff-no-rj,"klo di jalan aga rusak ""Empuk tp tidak halus"". Kaya Vios gen 1 gue.",5 months ago,0
Hey,UCc3kqLm82jx6OKHRyenrEPg,UgxHyU3JOwCqXSLDZx54AaABAg,0.0,https://yt3.ggpht.com/ytc/AKedOLRO2vGZflvXouqR5ful-ZgSvnAwNWI2PwqllUJW=s176-c-k-c0x00ffffff-no-rj,"Lagi liat review toyota, iklannya honda 😅",5 months ago,2
Jono Sugiharto,UCUBwFzACE2pG6PQIytEs4dg,UgwEa768NrbUpUwS8-l4AaABAg,0.0,https://yt3.ggpht.com/ytc/AKedOLRmO4SXxv65TknEm1t-SddmAU19wFsdHM3Y_4WE=s176-c-k-c0x00ffffff-no-rj,"Banyak fitur lainnya disunat ke basic,, kesedot harganya ke fitur TSS he he",5 months ago,0
Eko Haryanto,UCSO_ZBJjAkQO9ew-jtbd5mA,UgzGAQU41iWp0SUqcGx4AaABAg,0.0,https://yt3.ggpht.com/ytc/AKedOLSQ5zocv2B7ejJGADlQBaqmuYv5iYQUNKpREJwYwQ=s176-c-k-c0x00ffffff-no-rj,7:49 Suaranya ngaleng sekali,5 months ago,2
Fadillah Junfiana kumar,UCgrs0mPcP5L1Q3ZLdJ4XLIg,UgwbW4tClKSawdzTiph4AaABAg,0.0,https://yt3.ggpht.com/ytc/AKedOLQ6H5d1FcXfghHPLHnqSiz439pO6JdDhhP6eKeRxA=s176-c-k-c0x00ffffff-no-rj,"Serius minta pendapat, Kece mana si raize sama city hb?",5 months ago,0
evelyn tampubolon,UChbJQHlZDPwHQ6KvIRM8DLA,UgyuCHCeUTC69b68Ue54AaABAg,0.0,https://yt3.ggpht.com/ytc/AKedOLTgd5ByBLFVxGuMc7yKXobPf7NmuQhQR8oj3WId=s176-c-k-c0x00ffffff-no-rj,Ku tunggu kompetitornya Raize adik nya Almaz : Baojun  510,5 months ago,4
Enrile Indro,UCYwj0IHDJzLnBdLVRsJSvJg,Ugxq5g4ah-i_FHvYpQB4AaABAg,0.0,https://yt3.ggpht.com/ytc/AKedOLRoYuiNYNXf-56XTFPX-Znd-NO2EeUFZRfypNacew=s176-c-k-c0x00ffffff-no-rj,Di bawah 30 km/jam gak berfungsi ACC. Kalau macet di tol gak berguna ya.. padahal enak banget kalo bisa dipakai macet-macetan di tol. Kalau di tol lancar sih mending dipakai aja tenaga turbonya (ngebut)..,5 months ago (edited),0
Brader Andre,UCcu1B6wCXojJu1tyFfHP4pQ,UgxmUYLob3q4BQqFF8h4AaABAg.9Nvf_JdpIsV9OqB4pjJvwH,0.0,https://yt3.ggpht.com/eKNEXmt9cfk4NPrVAIWIVX_ZPAbpt3yeD09f-EOl8imZ5jsdPz3bpXI7PvZ0z2VTlPR70WX7zg=s176-c-k-c0x00ffffff-no-rj,"Sama aja sebenernya bang, cuma kalo toyota lebih premium ajaa pangsa pasarnya",5 months ago,0
Safwan fh,UCRJFT2wHynj6SQcxus21e3A,UgwRPNnevqjkUnaxT8l4AaABAg.9NvesUwxvVp9Nw2mzGVfzj,0.0,https://yt3.ggpht.com/ytc/AKedOLTQLH-3kr7mExxdD77KCwPb7Z-wfi76bj5T3GJ9=s176-c-k-c0x00ffffff-no-rj,Mana yang tercapai lebih dulu,5 months ago,0
dhany firdaus,UCbAd0unLUIvieRhh6bZnxIw,Ugzkl7i-RVbuQ7npzdt4AaABAg.9NvdNRhinYW9Nvjzkb9nYS,0.0,https://yt3.ggpht.com/ytc/AKedOLQuiTYeEOdPA83Wd4r4KhXe7u96q0GPyQxrFoYTbg=s176-c-k-c0x00ffffff-no-rj,"di sentul tembus 1 lap 2.08 set, dengan posisi TC off",5 months ago,0
Andri Juliansyah,UC2bZ6gbFvl7uKf9GXm9QhOw,UgwbW4tClKSawdzTiph4AaABAg.9NvaEO5Wwlj9PUwyciVzqj,0.0,https://yt3.ggpht.com/ytc/AKedOLTW54Affyecyy2-dkpEkwVNwzkq5wrWi-KcXA=s176-c-k-c0x00ffffff-no-rj,"City hb dong, beda harga aja hampir 50jt lebih mahal city hb",4 months ago,0
A.P. Nugie,UCt0HElCDpfJeTNNlNw0RohA,UgxMTxXBmZaorkyBX-R4AaABAg,0.0,https://yt3.ggpht.com/ytc/AKedOLRSsMPjqRtvXl4JAH-bDTJotnN-N8oadxTg0GJshg=s176-c-k-c0x00ffffff-no-rj,"udah saya duga, mobil ini dari tampilan sudah engga proper, cm ya Ridwan dan reviewer lain bilang empuk ya gw percaya meski masih ragu. akhirnya om Fitra bilang juga kalau suspensi nya gak enak, hehe.

dari tampilan kalo orang bilang Sienta empuk, sy percaya meskipun aslinya agak keras, karena desainnya proper, keliatan kokoh. kalo raize ini ya gimana ya, keliatan lah kalau bukan model mobil form, berkualitas. hehe ✌🏾",5 months ago,0
Yos Rabung,UCh-9iDKnoZ5mE8liL7vBt8Q,UgyCa1dR1rzZ0Z76dRB4AaABAg,0.0,https://yt3.ggpht.com/ytc/AKedOLR3j8LQ98gq_DEwWKdnsozKESO5o7Z7ade9YjEF3g=s176-c-k-c0x00ffffff-no-rj,Review mobil paling terstruktur dan jelas emang cuma Carmudi. Dengerin om Eri pas cerita sejarah mobil sama impresi berkendara aja,5 months ago,1
Sabda Alam Teduh Nusa,UC0LHm5o89SNgfwv7lw_ggPQ,UgzJeAlZLSUWqKFksPJ4AaABAg,0.0,https://yt3.ggpht.com/ytc/AKedOLRxprx8wnszAg9OKHrRHf6a-kQSMdRqPDkK98P5JQ=s176-c-k-c0x00ffffff-no-rj,Bikin komparasi raize vs rocky vs magnite vs sonet,5 months ago,0
Beli Mobil TV,UCmF6x6O6HXbZzoXNWQeJWnA,UgxWK-21hDhl1j8z-z14AaABAg,0.0,https://yt3.ggpht.com/C2dYFusJzOZNdDnnIxxPHANpFkY8zMZ7fVhezO5hjUqCViyzeR3qIrOhpBNZiNlN84Mq5iNu=s176-c-k-c0x00ffffff-no-rj,Raize tipe G lebih worth it untuk yang ogah inden lama 😄,5 months ago,7
wawan minson,UC4XHHJQBbcy9EdgUuYU8kpg,UgwIaedaZ33rSLtR48N4AaABAg,0.0,https://yt3.ggpht.com/ytc/AKedOLQToT9khyiMhIDQPEuCXjaSIR-xy0UUP6wBaCHcNg=s176-c-k-c0x00ffffff-no-rj,"Suara mesin khas 3 silinder saat akselerasi, justru banyak yg sukaaa ganti knalpot broooommmm 😀",5 months ago,4
dora emon,UCysM8CBTjS5nwZ-IJqqvNEg,UgzQ1cqr7PP_FbylPst4AaABAg,0.0,https://yt3.ggpht.com/ytc/AKedOLR7wR_yRGOlExQ4zYEd6zqE8LQnQctMNsBKxA=s176-c-k-c0x00ffffff-no-rj,Cocok buat kantong pas2an tapi mau tampil kece.,5 months ago,0
rahmat setiawan,UCuMYuwjBzO61XHh9q3-V1Xg,UgzWHEio8lrF9Ae_z-d4AaABAg,0.0,https://yt3.ggpht.com/ytc/AKedOLQMFZ48AS6UQJNbsTrnRO5reS-qehZqzXrVHkgcog=s176-c-k-c0x00ffffff-no-rj,Raize itu generasi rush yg sesungguhnya... Bentuknya lebih mirip dgn rush lama dibanding new rush yg skrng... Nama rush dan raize kalau dibaca mirip mirplah.. 😅,5 months ago,16
Subakti Crb,UC9l4ieewQNILbshl0Czf33Q,UgxUrtmigOIjCgUonrZ4AaABAg,0.0,https://yt3.ggpht.com/ytc/AKedOLQ6X40ONnqoQ7P4rCN4gUAPiroA-qhusMzLDsKI=s176-c-k-c0x00ffffff-no-rj,Bakalan jadi mobil sejuta umat,5 months ago,0
moko argja,UCRDqVbXZKP2LyqojdrwUnQg,UgzEyQwoGL3Y-ncos3l4AaABAg,0.0,https://yt3.ggpht.com/ytc/AKedOLQhFWfoR18WJQ8qa6geB-53M8lmphg8eXvqdQ=s176-c-k-c0x00ffffff-no-rj,Wah mantap mas semangat terus jaga kesehatan salam dari saya Moko walaupun saya seorang  disabilitas netra tapi saya senang mendengar review dari mas  vitra.,5 months ago,21
Adi Winata,UCKcTeseeCG__Ip0RT2EryNA,UgyNG33VCOLo4xWrExl4AaABAg,0.0,https://yt3.ggpht.com/ytc/AKedOLQHBNIw7QIVMIIed8Fo05iCtZAVr0C7J3zxqQ=s176-c-k-c0x00ffffff-no-rj,Apa gw bilang hah.. hahaha..mau diblg sales korea gw mah.. terserahh.. udh gw blg ini brng tdk sekelas sonet.. ini hnya alat tukar supaya perusahaan sukses.. mau smpai kpn disajikan bgnian trus. Kpn kira2 duo japan bs memberikn seimpresive korea tnpa hrus up harga jual.,5 months ago,1
Eric Holle,UCAak3zwJhKW22bL1MA4hRwQ,Ugzqe1hn2ZtGN9HwYV94AaABAg,0.0,https://yt3.ggpht.com/ytc/AKedOLQLaawUzHRe095xN-suVyVdMiq4Xo5gyG33Blsb=s176-c-k-c0x00ffffff-no-rj,Review jujur dan menyenangkan.. Trims,5 months ago,0
Robby Suliantoro,UCX2NVCbZzBaQruEATFhK7Ug,UgwlgUovLbpyG5mx_4Z4AaABAg,0.0,https://yt3.ggpht.com/ytc/AKedOLSz0_df6-Emp64_7WDzmFnZbjuea0MhRVKSYXdjWJ4=s176-c-k-c0x00ffffff-no-rj,beli raize langsung lunas dari kapal api dan shell,5 months ago,0
minan sugiyarto,UCbxxOGZXWQimdbiAFEnLQcw,UgwJVYr1--UHZuW3koV4AaABAg,0.0,https://yt3.ggpht.com/ytc/AKedOLSbKLFUMvoKZWCr1BRFPYyF47SFVEjZWhwbwN97=s176-c-k-c0x00ffffff-no-rj,GRsport,5 months ago,0
Andri Pratama,UCXSrGn6lI8ahgU7l8aIa__w,UgzALUsr7ZUMnWF3_Xx4AaABAg,0.0,https://yt3.ggpht.com/ytc/AKedOLTLvwbbFcsVLBT4j02YNK7UOiaapxwgRvIyHqPhW8M=s176-c-k-c0x00ffffff-no-rj,21:11 ini pertama kali saya denger ada reviewer Indonesia yg mereferensikan jarak dgn benar (time distance).,5 months ago,0
erwin sebastian,UCz9byCMDVgatjYZeLc_U6IA,UgzzPJIvVYoUP-p_nMZ4AaABAg,0.0,https://yt3.ggpht.com/ytc/AKedOLRq0ZPZJaCDRN97jR8xTFlURDGasTP2EjTaPGuHTA=s176-c-k-c0x00ffffff-no-rj,Di tunggu komperasi dengan kia sonet Om 🙌🏼,5 months ago,3
Hendrian Dwi,UCiy2T6D-8ZrPJRq26hZTLuQ,UgxgUMtxatkAh2lZwKB4AaABAg,0.0,https://yt3.ggpht.com/ytc/AKedOLSC_P0qiTJKCPsACb6t1BL1JnO9NGq83M2jBv9qgQ=s176-c-k-c0x00ffffff-no-rj,Matic ya itu?,5 months ago,0
Dungdung Pret,UCN4Exm2JUFGc_mfODxmtTaw,UgzeIR8m2V3rqswjYlR4AaABAg,0.0,https://yt3.ggpht.com/ia1FRrsC1hoJYK1ZYE2cSpQMxdTucQ7RNQvGYl2K1AJZ7Yh9Xs-hTwhW6j9jS0OBXjM21vQ4tw=s176-c-k-c0x00ffffff-no-rj,"Seandainya: 
4 silinder
1.200 CC + turbo=
SEMPURNA 👍👍👍",5 months ago,0
Olle,UChcIEQRXudzck5VbxGctSVQ,UgyhUUHUJ4hCu1wSYth4AaABAg,0.0,https://yt3.ggpht.com/ytc/AKedOLS9OPL8twvBTqtq-ozJyuT1cG7pLRkOmscBL9qlPU0=s176-c-k-c0x00ffffff-no-rj,"Udah makin canggih teknologi mesin malah di downgrade 3 silinder, ohh Toyota..Cuma manusia yang gak sempurna, mobil jangan ikut2an dibuat setengah2 laahhh.. 🤦🏻‍♂️",5 months ago,0
Rifqi Tyas Samodro,UCcflEwm80EyuAgC_HppmNZA,UgxevBq39vwMk4teRC54AaABAg,0.0,https://yt3.ggpht.com/ytc/AKedOLR7u7kd99Dw82WiRj72BBhIZ5JoiPXqnk_UogHE=s176-c-k-c0x00ffffff-no-rj,Dikibulin Toyota.,5 months ago,0
yutub 265,UCFiWqtGHJx7gMRfJh8i51_Q,Ugy_Twapl_ZR07sfH1t4AaABAg,0.0,https://yt3.ggpht.com/ytc/AKedOLSqhfMySvhxd6DKVNIp7nBVUJwt1Hlg1Oj2fvQMZoAoUMzUdpniisE-LZQV7itR=s176-c-k-c0x00ffffff-no-rj,Kia sonet : ah gaasix pake tss,5 months ago,0
Ifaldi,UC2gzkbaSTtMu5ZwovotFbAg,UgxWK-21hDhl1j8z-z14AaABAg.9NvYpKurWnJ9Nx3BWOHRuL,0.0,https://yt3.ggpht.com/ytc/AKedOLRLwRSB6Ryu7C2kZBgFLlnHgMXEgyK6UbzD-A=s176-c-k-c0x00ffffff-no-rj,Mobil keluaran terbaru manapun wajar kalo inden lama ngab. Dulu juga xpander gitu,5 months ago,0
Beli Mobil TV,UCmF6x6O6HXbZzoXNWQeJWnA,UgxWK-21hDhl1j8z-z14AaABAg.9NvYpKurWnJ9Nx3qFnT_9g,0.0,https://yt3.ggpht.com/C2dYFusJzOZNdDnnIxxPHANpFkY8zMZ7fVhezO5hjUqCViyzeR3qIrOhpBNZiNlN84Mq5iNu=s176-c-k-c0x00ffffff-no-rj, @Ifaldi  iye bro yang penting sabar aje,5 months ago,0
Yogi Afridhitama,UCNELeGI4o43spCVU3plbHpA,UgwIaedaZ33rSLtR48N4AaABAg.9NvYedN0vy69NziGbCNWlH,0.0,https://yt3.ggpht.com/ytc/AKedOLQh1ndOHF3K82-RPjSB_2tvFBP5RUI-kBvuydc3mw=s176-c-k-c0x00ffffff-no-rj,Brooomm broommm kaya suara motor🤣 ga rapat suaranya,5 months ago,0
Wahyu Agung,UCRhsbAmV8eWIEP_boho09fg,UgzWHEio8lrF9Ae_z-d4AaABAg.9NvWxhWOFWQ9Nw-Nejuc1F,0.0,https://yt3.ggpht.com/ytc/AKedOLS9saOEs346mGS8Xv4Dr9Ez_IFxhZIAG_Pd9FAbYA=s176-c-k-c0x00ffffff-no-rj,"rada masuk akal sih walaupun agak maksa, wkwk, mengingat di negeri asal nya, rush udah discontinue",5 months ago,2
Leo Nard,UCoKH_Rn5-i3ubI81wegVvfQ,UgzWHEio8lrF9Ae_z-d4AaABAg.9NvWxhWOFWQ9NwPxBftaIZ,0.0,https://yt3.ggpht.com/ytc/AKedOLS0cXPS46HgtRsmMcPF4F_MOpM_HRy7l4ZlIUk1ZQ=s176-c-k-c0x00ffffff-no-rj,Nah iya bener nih...model rush skrg mending jd model baru nya avanza..,5 months ago,2
Tunggal DJL,UCBL82SsxzxDQuNVSI6ajQZA,UgzWHEio8lrF9Ae_z-d4AaABAg.9NvWxhWOFWQ9NzVU3CZlJZ,0.0,https://yt3.ggpht.com/ytc/AKedOLQJuAb3toh8jvWyrjbSvvwcfuZnKz9gRrk85miTTA=s176-c-k-c0x00ffffff-no-rj,"iya setuju, Raize sangat cocok klo disebut regenerasi Rush, sementara All New Rush lebih cocok jd Regenerasi Avanza atau Avanza yang disempurnakan 😁",5 months ago,2
Ashari P,UC0Rc2ngVtg6WaQAk1F03lkg,UgzWHEio8lrF9Ae_z-d4AaABAg.9NvWxhWOFWQ9PuIcA0N6Ec,0.0,https://yt3.ggpht.com/ytc/AKedOLT172vZpWKfF3-cKwiIuIUU9t_bhIaP7C5YuNEYdg=s176-c-k-c0x00ffffff-no-rj,Rush di Jepang namanya Toyota Be-Go,4 months ago,0
Wahyu Agung,UCRhsbAmV8eWIEP_boho09fg,UgzWHEio8lrF9Ae_z-d4AaABAg.9NvWxhWOFWQ9Pv7G1hf7Yz,0.0,https://yt3.ggpht.com/ytc/AKedOLS9saOEs346mGS8Xv4Dr9Ez_IFxhZIAG_Pd9FAbYA=s176-c-k-c0x00ffffff-no-rj," @Ashari P  itu mah yg Daihatsu, klo yg Toyota ttep rush nama nya",4 months ago,0
Ashari P,UC0Rc2ngVtg6WaQAk1F03lkg,UgzWHEio8lrF9Ae_z-d4AaABAg.9NvWxhWOFWQ9PvNzpt1OeI,0.0,https://yt3.ggpht.com/ytc/AKedOLT172vZpWKfF3-cKwiIuIUU9t_bhIaP7C5YuNEYdg=s176-c-k-c0x00ffffff-no-rj, @Wahyu Agung  tapi aslinya Rush - Terios ya originalnya punya Daihatsu pengembangan dari Daihatsu Taruna,4 months ago,0
Wahyu Agung,UCRhsbAmV8eWIEP_boho09fg,UgzWHEio8lrF9Ae_z-d4AaABAg.9NvWxhWOFWQ9PvPSa3GQ6N,0.0,https://yt3.ggpht.com/ytc/AKedOLS9saOEs346mGS8Xv4Dr9Ez_IFxhZIAG_Pd9FAbYA=s176-c-k-c0x00ffffff-no-rj," @Ashari P  iya tau lah klo itu, orang mereka satu pabrikan, Raize versi Jepang pun juga rakitan Daihatsu",4 months ago,0
Ashari P,UC0Rc2ngVtg6WaQAk1F03lkg,UgzWHEio8lrF9Ae_z-d4AaABAg.9NvWxhWOFWQ9PvQ1zFxVM4,0.0,https://yt3.ggpht.com/ytc/AKedOLT172vZpWKfF3-cKwiIuIUU9t_bhIaP7C5YuNEYdg=s176-c-k-c0x00ffffff-no-rj, @Wahyu Agung  dari penamaan aja udah beda dari bro originalnya Terios Rush ya Daihatsu Be-Go / Taruna dengan platform RWD / AWD sedangkan Raize Rocky FWD / AWD,4 months ago,0
Kun,UCHLgdRnGeQezWjFn2RqtLDg,UgzALUsr7ZUMnWF3_Xx4AaABAg.9NvVOfQAfJC9Nve-wgrqFM,0.0,https://yt3.ggpht.com/ytc/AKedOLRsZysucRB3es93GtYpy8WKNCDYhe2lX19CqFZZxQ=s176-c-k-c0x00ffffff-no-rj,"biasanya pake jarak ""100 m atau 2 tiang listrik"" ya hahaha
mungkin karena om Fitra pembalap profesional jadi udah terbiasa pakai time distance",5 months ago,0
Andri Pratama,UCXSrGn6lI8ahgU7l8aIa__w,UgzALUsr7ZUMnWF3_Xx4AaABAg.9NvVOfQAfJC9Nw2FZAIIfq,0.0,https://yt3.ggpht.com/ytc/AKedOLTLvwbbFcsVLBT4j02YNK7UOiaapxwgRvIyHqPhW8M=s176-c-k-c0x00ffffff-no-rj," @Kun  menengok ke belakang, rasanya dulu2 GenX seperti saya ketika sama2 belajar nyetir, kita sudah familiar dengan time distance dan cara ""ngukur""nya di jalanan dgn patokan benda mati. Kenapa sekarang awareness soal ini kurang ya.... Mungkin reviewer seperti Om Fitra sekali2 harus ada konten edukasi berlalu lintas.",5 months ago (edited),0
